-- phpMyAdmin SQL Dump
-- version 3.5.2.2
-- http://www.phpmyadmin.net
--
-- Servidor: 127.0.0.1
-- Tiempo de generaci칩n: 22-09-2017 a las 23:18:06
-- Versi칩n del servidor: 5.5.27
-- Versi칩n de PHP: 5.4.7

SET SQL_MODE="NO_AUTO_VALUE_ON_ZERO";
SET time_zone = "+00:00";


/*!40101 SET @OLD_CHARACTER_SET_CLIENT=@@CHARACTER_SET_CLIENT */;
/*!40101 SET @OLD_CHARACTER_SET_RESULTS=@@CHARACTER_SET_RESULTS */;
/*!40101 SET @OLD_COLLATION_CONNECTION=@@COLLATION_CONNECTION */;
/*!40101 SET NAMES utf8 */;

--
-- Base de datos: `restobar`
--

-- --------------------------------------------------------

--
-- Estructura de tabla para la tabla `almacen`
--

CREATE TABLE IF NOT EXISTS `almacen` (
  `idalmacen` int(10) NOT NULL AUTO_INCREMENT,
  `idorg` int(10) NOT NULL,
  `idsede` int(10) NOT NULL,
  `descripcion` varchar(50) NOT NULL,
  `bodega` int(1) NOT NULL DEFAULT '0' COMMENT 'donde estas las gaseosas, cervezas, golosinas helados otros',
  `imprimir_comanda` int(1) NOT NULL DEFAULT '0' COMMENT '1:Si el pedido tiene solo items de este almacen imprime comanda',
  `estado` int(1) NOT NULL DEFAULT '0',
  PRIMARY KEY (`idalmacen`)
) ENGINE=InnoDB  DEFAULT CHARSET=latin1 AUTO_INCREMENT=4 ;

--
-- Volcado de datos para la tabla `almacen`
--

INSERT INTO `almacen` (`idalmacen`, `idorg`, `idsede`, `descripcion`, `bodega`, `imprimir_comanda`, `estado`) VALUES
(1, 1, 1, 'ALMACEN CENTRAL', 0, 0, 0),
(2, 1, 1, 'COCINA', 0, 0, 0),
(3, 1, 1, 'BODEGA', 1, 1, 0);

-- --------------------------------------------------------

--
-- Estructura de tabla para la tabla `almacen_ie`
--

CREATE TABLE IF NOT EXISTS `almacen_ie` (
  `idalmacen_ie` int(10) NOT NULL AUTO_INCREMENT,
  `idorg` int(10) NOT NULL,
  `idsede` int(10) NOT NULL,
  `idusuario` int(10) NOT NULL,
  `tipo` varchar(1) NOT NULL COMMENT '1:entrada 2:salida',
  `fecha` varchar(30) NOT NULL,
  `idalmacen` int(10) NOT NULL,
  `idproducto_motivo_es` int(1) NOT NULL,
  `motivo` char(120) NOT NULL,
  `estado` int(1) NOT NULL DEFAULT '0',
  PRIMARY KEY (`idalmacen_ie`)
) ENGINE=InnoDB  DEFAULT CHARSET=latin1 AUTO_INCREMENT=29 ;

--
-- Volcado de datos para la tabla `almacen_ie`
--

INSERT INTO `almacen_ie` (`idalmacen_ie`, `idorg`, `idsede`, `idusuario`, `tipo`, `fecha`, `idalmacen`, `idproducto_motivo_es`, `motivo`, `estado`) VALUES
(1, 1, 1, 1, '1', '07/04/2017', 3, 0, 'DEVOLUCION', 0),
(2, 1, 1, 1, '1', '07/04/2017', 3, 0, 'DEVOLUCION', 0),
(3, 1, 1, 1, '1', '07/04/2017', 3, 0, 'DEVOLUCION', 0),
(4, 1, 1, 1, '1', '07/04/2017', 3, 0, 'DEVOLUCION', 0),
(5, 1, 1, 1, '2', '07/04/2017', 2, 0, 'CONSUMO DEL PERSONAL', 0),
(6, 1, 1, 1, '2', '07/04/2017', 2, 0, 'CONSUMO DEL PERSONAL', 0),
(7, 1, 1, 1, '1', '07/04/2017', 2, 0, 'DEVOLUCION', 0),
(8, 1, 1, 1, '1', '07/04/2017', 2, 0, 'DEVOLUCION', 0),
(9, 1, 1, 1, '2', '09/05/2017', 1, 0, 'AAAA', 0),
(10, 1, 1, 1, '2', '09/05/2017', 1, 0, '', 0),
(11, 1, 1, 1, '2', '09/05/2017', 1, 0, '', 0),
(12, 1, 1, 1, '2', '09/05/2017', 1, 0, '', 0),
(13, 1, 1, 1, '2', '09/05/2017', 1, 0, '', 0),
(14, 1, 1, 1, '2', '09/05/2017', 1, 0, '', 0),
(15, 1, 1, 1, '2', '09/05/2017', 1, 0, '', 0),
(16, 1, 1, 1, '2', '13/05/2017', 3, 0, 'VENCIDOS', 0),
(17, 1, 1, 1, '2', '13/05/2017', 3, 0, 'AAA', 0),
(18, 1, 1, 1, '2', '13/05/2017', 3, 0, 'VENCIMIENTO', 0),
(19, 1, 1, 1, '2', '13/05/2017', 3, 0, '', 0),
(20, 1, 1, 1, '1', '13/05/2017', 3, 0, 'BONIFICACION DEL PROVEEDOR', 0),
(21, 1, 1, 1, '2', '13/05/2017', 2, 0, 'ALMUERZO', 0),
(22, 1, 1, 1, '1', '13/05/2017', 2, 0, '', 0),
(23, 1, 1, 1, '1', '18/05/2017', 3, 0, '', 0),
(24, 1, 1, 1, '2', '18/05/2017', 3, 0, '', 0),
(25, 1, 1, 1, '2', '18/05/2017', 3, 4, 'VENCIMIENTO', 0),
(26, 1, 1, 1, '2', '18/05/2017', 1, 4, '', 0),
(27, 1, 1, 1, '2', '18/05/2017', 3, 4, '', 0),
(28, 1, 1, 1, '2', '18/05/2017', 3, 5, 'BRINDIS POR BUENAS VENTAS', 0);

--
-- Disparadores `almacen_ie`
--
DROP TRIGGER IF EXISTS `kardex_ingreso_almacen`;
DELIMITER //
CREATE TRIGGER `kardex_ingreso_almacen` AFTER INSERT ON `almacen_ie`
 FOR EACH ROW insert into kardex (idoperacion,idorg,idsede,idalmacen,tipo_operacion,fecha,documento)
values (concat('A',new.idalmacen_ie), new.idorg,new.idsede,new.idalmacen,new.tipo,new.fecha,new.motivo)
//
DELIMITER ;

-- --------------------------------------------------------

--
-- Estructura de tabla para la tabla `almacen_ie_detalle`
--

CREATE TABLE IF NOT EXISTS `almacen_ie_detalle` (
  `idalmacen_ie_detalle` int(10) NOT NULL AUTO_INCREMENT,
  `idalmacen_ie` int(10) NOT NULL,
  `idp` int(11) NOT NULL COMMENT 'producto / porcion',
  `procede` int(1) NOT NULL COMMENT '0:porducto 1:porcion',
  `cantidad` varchar(10) NOT NULL,
  `estado` int(1) NOT NULL DEFAULT '0',
  PRIMARY KEY (`idalmacen_ie_detalle`)
) ENGINE=InnoDB  DEFAULT CHARSET=latin1 AUTO_INCREMENT=25 ;

--
-- Volcado de datos para la tabla `almacen_ie_detalle`
--

INSERT INTO `almacen_ie_detalle` (`idalmacen_ie_detalle`, `idalmacen_ie`, `idp`, `procede`, `cantidad`, `estado`) VALUES
(1, 2, 57, 0, '1', 0),
(2, 3, 57, 0, '1', 0),
(3, 4, 32, 0, '2', 0),
(4, 4, 57, 0, '1', 0),
(5, 5, 2, 1, '-2', 0),
(6, 6, 2, 1, '-1', 0),
(7, 8, 2, 1, '1', 0),
(8, 9, 35, 0, '-2', 0),
(9, 10, 35, 0, '1', 0),
(10, 13, 35, 0, '-5', 0),
(11, 18, 59, 0, '-2', 0),
(12, 19, 78, 0, '-2', 0),
(13, 19, 59, 0, '-5', 0),
(14, 20, 78, 0, '2', 0),
(15, 20, 59, 0, '5', 0),
(16, 21, 3, 1, '-6', 0),
(17, 22, 3, 1, '20', 0),
(18, 23, 39, 0, '10', 0),
(19, 24, 39, 0, '-5', 0),
(20, 25, 39, 0, '-5', 0),
(21, 26, 81, 0, '-6', 0),
(22, 27, 81, 0, '-6', 0),
(23, 28, 59, 0, '-2', 0),
(24, 28, 63, 0, '-10', 0);

--
-- Disparadores `almacen_ie_detalle`
--
DROP TRIGGER IF EXISTS `stock_insert_almacen_i`;
DELIMITER //
CREATE TRIGGER `stock_insert_almacen_i` BEFORE INSERT ON `almacen_ie_detalle`
 FOR EACH ROW IF new.procede=0 THEN
UPDATE producto_stock SET stock = stock + new.cantidad WHERE idproducto=new.idp and idalmacen=(select idalmacen from almacen_ie where idalmacen_ie=new.idalmacen_ie);
else
update porcion set stock=stock+new.cantidad where idporcion=new.idp;
END IF
//
DELIMITER ;

-- --------------------------------------------------------

--
-- Estructura de tabla para la tabla `almacen_items`
--

CREATE TABLE IF NOT EXISTS `almacen_items` (
  `idalmacen_items` int(10) NOT NULL AUTO_INCREMENT,
  `idalmacen` int(10) NOT NULL,
  `idproducto` int(10) NOT NULL,
  `stock` varchar(10) NOT NULL,
  `f_ingreso` varchar(50) NOT NULL,
  `estado` int(1) NOT NULL DEFAULT '0',
  PRIMARY KEY (`idalmacen_items`)
) ENGINE=InnoDB  DEFAULT CHARSET=latin1 AUTO_INCREMENT=187 ;

--
-- Volcado de datos para la tabla `almacen_items`
--

INSERT INTO `almacen_items` (`idalmacen_items`, `idalmacen`, `idproducto`, `stock`, `f_ingreso`, `estado`) VALUES
(1, 2, 1, '0', '30/01/2017', 0),
(2, 2, 2, '0', '30/01/2017', 0),
(3, 2, 3, '0', '30/01/2017', 0),
(4, 2, 4, '0', '30/01/2017', 0),
(5, 2, 5, '0', '30/01/2017', 0),
(6, 2, 6, '0', '30/01/2017', 0),
(7, 2, 7, '0', '30/01/2017', 0),
(8, 2, 8, '0', '30/01/2017', 1),
(9, 2, 9, '0', '30/01/2017', 0),
(10, 2, 10, '0', '30/01/2017', 0),
(11, 3, 11, '0', '30/01/2017', 0),
(12, 3, 12, '0', '30/01/2017', 0),
(13, 3, 13, '0', '30/01/2017', 0),
(14, 3, 14, '-2', '30/01/2017', 0),
(15, 3, 15, '5', '30/01/2017', 0),
(16, 3, 16, '1', '30/01/2017', 0),
(17, 3, 17, '-1', '30/01/2017', 0),
(18, 3, 18, '-1', '30/01/2017', 0),
(19, 3, 19, '-1', '30/01/2017', 0),
(20, 3, 20, '-3', '30/01/2017', 0),
(21, 3, 21, '-9', '30/01/2017', 0),
(22, 3, 22, '-5', '30/01/2017', 0),
(23, 3, 23, '1', '30/01/2017', 0),
(24, 3, 24, '6', '30/01/2017', 0),
(25, 3, 25, '7', '30/01/2017', 0),
(26, 3, 26, '21', '30/01/2017', 0),
(27, 3, 27, '40', '30/01/2017', 0),
(28, 3, 28, '35', '30/01/2017', 0),
(29, 3, 29, '36', '30/01/2017', 0),
(30, 3, 30, '32', '30/01/2017', 0),
(31, 3, 31, '7', '30/01/2017', 0),
(32, 3, 32, '-32', '30/01/2017', 0),
(33, 3, 33, '-13', '30/01/2017', 0),
(34, 3, 34, '-14', '30/01/2017', 0),
(35, 3, 35, '-12', '30/01/2017', 0),
(36, 3, 36, '6', '30/01/2017', 0),
(37, 3, 37, '6', '30/01/2017', 0),
(38, 3, 38, '23', '30/01/2017', 0),
(39, 3, 39, '-30', '30/01/2017', 0),
(40, 3, 40, '-31', '30/01/2017', 0),
(41, 3, 41, '-39', '30/01/2017', 0),
(42, 3, 42, '-35', '30/01/2017', 0),
(43, 2, 6, '0', '31/01/2017', 0),
(44, 2, 4, '4200', '31/01/2017', 0),
(45, 2, 43, '2000', '31/01/2017', 0),
(46, 2, 44, '2000', '31/01/2017', 0),
(47, 2, 45, '2', '31/01/2017', 0),
(48, 2, 46, '0', '31/01/2017', 0),
(49, 2, 47, '1000', '31/01/2017', 0),
(50, 2, 48, '1', '31/01/2017', 0),
(51, 3, 49, '-1', '31/01/2017', 0),
(52, 3, 50, '-50', '31/01/2017', 0),
(53, 3, 51, '-1', '31/01/2017', 0),
(54, 2, 8, '-13', '01/02/2017', 1),
(55, 2, 6, '-4', '01/02/2017', 0),
(56, 2, 7, '0', '01/02/2017', 0),
(57, 2, 43, '3970', '01/02/2017', 0),
(58, 2, 44, '979', '01/02/2017', 0),
(59, 2, 45, '-41', '01/02/2017', 0),
(60, 2, 10, '0', '01/02/2017', 0),
(61, 3, 52, '88', '02/02/2017', 0),
(62, 3, 18, '-5', '02/02/2017', 0),
(63, 3, 53, '3', '02/02/2017', 0),
(64, 3, 22, '2', '02/02/2017', 0),
(65, 3, 54, '-1', '02/02/2017', 0),
(66, 3, 55, '6', '02/02/2017', 0),
(67, 1, 33, '12', '03/02/2017', 0),
(68, 1, 42, '24', '03/02/2017', 0),
(69, 1, 56, '2', '03/02/2017', 1),
(70, 3, 33, '12', '03/02/2017', 0),
(71, 3, 42, '24', '03/02/2017', 0),
(72, 3, 41, '24', '04/02/2017', 0),
(73, 3, 40, '12', '04/02/2017', 0),
(74, 3, 35, '-4', '04/02/2017', 0),
(75, 3, 34, '-3', '04/02/2017', 0),
(76, 3, 57, '-4', '04/02/2017', 0),
(77, 2, 8, '0', '05/02/2017', 1),
(78, 2, 9, '0', '05/02/2017', 0),
(79, 2, 5, '0', '05/02/2017', 0),
(80, 3, 58, '-2', '05/02/2017', 0),
(81, 2, 8, '0', '07/02/2017', 1),
(82, 2, 9, '0', '07/02/2017', 0),
(83, 2, 6, '0', '07/02/2017', 0),
(84, 2, 8, '0', '10/02/2017', 1),
(85, 2, 9, '0', '10/02/2017', 0),
(86, 3, 59, '43', '11/02/2017', 0),
(87, 3, 61, '10', '11/02/2017', 0),
(88, 3, 58, '12', '11/02/2017', 0),
(89, 3, 62, '0', '11/02/2017', 0),
(90, 3, 63, '0', '11/02/2017', 0),
(91, 3, 64, '3', '11/02/2017', 0),
(92, 3, 65, '9', '11/02/2017', 0),
(93, 2, 66, '0', '11/02/2017', 0),
(94, 2, 67, '0', '11/02/2017', 0),
(95, 3, 40, '12', '12/02/2017', 0),
(96, 3, 41, '12', '12/02/2017', 0),
(97, 3, 57, '12', '12/02/2017', 0),
(98, 3, 39, '30', '12/02/2017', 0),
(99, 3, 34, '6', '12/02/2017', 0),
(100, 3, 35, '6', '12/02/2017', 0),
(101, 2, 8, '0', '12/02/2017', 1),
(102, 2, 9, '0', '12/02/2017', 0),
(103, 2, 4, '3000', '12/02/2017', 0),
(104, 2, 5, '0', '12/02/2017', 0),
(105, 2, 6, '0', '13/02/2017', 0),
(106, 3, 74, '12', '14/02/2017', 0),
(107, 3, 75, '0', '14/02/2017', 0),
(108, 2, 8, '0', '15/02/2017', 1),
(109, 2, 9, '0', '15/02/2017', 0),
(110, 2, 7, '0', '15/02/2017', 0),
(111, 2, 8, '0', '16/02/2017', 1),
(112, 2, 9, '0', '16/02/2017', 0),
(113, 2, 6, '0', '16/02/2017', 0),
(114, 2, 5, '0', '16/02/2017', 0),
(115, 2, 10, '0', '16/02/2017', 0),
(116, 3, 11, '13', '16/02/2017', 0),
(117, 3, 11, '6', '16/02/2017', 0),
(118, 3, 13, '12', '16/02/2017', 0),
(119, 3, 18, '6', '16/02/2017', 0),
(120, 3, 19, '6', '16/02/2017', 0),
(121, 3, 20, '6', '16/02/2017', 0),
(122, 3, 24, '30', '16/02/2017', 0),
(123, 3, 21, '18', '16/02/2017', 0),
(124, 3, 17, '9', '16/02/2017', 0),
(125, 3, 55, '06', '16/02/2017', 0),
(126, 3, 54, '06', '16/02/2017', 0),
(127, 3, 22, '06', '16/02/2017', 0),
(128, 3, 22, '06', '16/02/2017', 0),
(129, 3, 52, '100', '16/02/2017', 0),
(130, 3, 14, '12', '16/02/2017', 0),
(131, 1, 32, '50', '17/02/2017', 0),
(132, 1, 33, '12', '17/02/2017', 0),
(133, 1, 42, '12', '17/02/2017', 0),
(134, 3, 32, '60', '17/02/2017', 0),
(135, 3, 33, '12', '17/02/2017', 0),
(136, 3, 42, '12', '17/02/2017', 0),
(137, 3, 40, '12', '17/02/2017', 0),
(138, 3, 41, '12', '17/02/2017', 0),
(139, 3, 57, '12', '17/02/2017', 0),
(140, 3, 34, '6', '17/02/2017', 0),
(141, 2, 8, '0', '17/02/2017', 1),
(142, 2, 9, '0', '17/02/2017', 0),
(143, 3, 76, '1', '17/02/2017', 0),
(144, 2, 8, '0', '18/02/2017', 1),
(145, 2, 67, '0', '18/02/2017', 0),
(146, 2, 66, '0', '18/02/2017', 0),
(147, 2, 34, '0', '18/02/2017', 0),
(148, 3, 34, '4', '18/02/2017', 0),
(149, 2, 8, '0', '19/02/2017', 1),
(150, 2, 9, '0', '19/02/2017', 0),
(151, 2, 6, '0', '19/02/2017', 0),
(152, 2, 7, '0', '19/02/2017', 0),
(153, 2, 77, '0', '02/03/2017', 0),
(154, 2, 77, '0', '02/03/2017', 0),
(155, 2, 8, '0', '02/03/2017', 1),
(156, 2, 9, '0', '02/03/2017', 0),
(157, 2, 10, '0', '02/03/2017', 0),
(158, 3, 76, '1', '07/04/2017', 0),
(159, 3, 57, '1', '07/04/2017', 0),
(160, 3, 57, '-1', '07/04/2017', 0),
(161, 3, 57, '-1', '07/04/2017', 0),
(162, 3, 57, '1', '07/04/2017', 0),
(163, 3, 57, '1', '07/04/2017', 0),
(164, 3, 32, '2', '07/04/2017', 0),
(165, 3, 57, '1', '07/04/2017', 0),
(166, 3, 34, '15', '09/05/2017', 0),
(167, 3, 35, '12', '09/05/2017', 0),
(168, 1, 35, '-2', '09/05/2017', 0),
(169, 1, 35, '1', '09/05/2017', 0),
(170, 1, 35, '-2', '09/05/2017', 0),
(171, 1, 35, '-2', '09/05/2017', 0),
(172, 1, 35, '-5', '09/05/2017', 0),
(173, 1, 35, '-3', '09/05/2017', 0),
(174, 1, 35, '-6', '09/05/2017', 0),
(175, 3, 59, '12', '13/05/2017', 0),
(176, 3, 78, '10', '13/05/2017', 0),
(177, 3, 59, '-2', '13/05/2017', 0),
(178, 3, 59, '12', '13/05/2017', 0),
(179, 3, 59, '12', '13/05/2017', 0),
(180, 2, 8, '1000', '17/05/2017', 1),
(181, 2, 79, '30', '17/05/2017', 0),
(182, 2, 8, '2000', '17/05/2017', 1),
(183, 2, 39, '15', '17/05/2017', 0),
(184, 3, 39, '30', '17/05/2017', 0),
(185, 2, 80, '5', '17/05/2017', 0),
(186, 2, 87, '5000', '15/06/2017', 0);

-- --------------------------------------------------------

--
-- Estructura de tabla para la tabla `almacen_motivo_es`
--

CREATE TABLE IF NOT EXISTS `almacen_motivo_es` (
  `idalmacen_motivo_es` int(1) NOT NULL AUTO_INCREMENT,
  `motivo` char(50) NOT NULL,
  `tipo` int(1) NOT NULL COMMENT '1: ENTRADA 2:SALIDAS',
  `estado` int(1) NOT NULL DEFAULT '0',
  KEY `idproducto_motivo_es` (`idalmacen_motivo_es`)
) ENGINE=InnoDB  DEFAULT CHARSET=latin1 AUTO_INCREMENT=7 ;

--
-- Volcado de datos para la tabla `almacen_motivo_es`
--

INSERT INTO `almacen_motivo_es` (`idalmacen_motivo_es`, `motivo`, `tipo`, `estado`) VALUES
(1, 'COMPRAS', 1, 0),
(2, 'DEVOLUCIONES', 1, 0),
(3, 'VENTAS', 2, 0),
(4, 'DETERIORO', 2, 0),
(5, 'CONSUMO DEL PERSONAL', 2, 0),
(6, 'BONIFICACIONES', 1, 0);

-- --------------------------------------------------------

--
-- Estructura de tabla para la tabla `carta`
--

CREATE TABLE IF NOT EXISTS `carta` (
  `idcarta` int(10) NOT NULL AUTO_INCREMENT,
  `idorg` int(10) NOT NULL,
  `idsede` int(10) NOT NULL,
  `idcategoria` int(10) NOT NULL,
  `fecha` varchar(25) NOT NULL,
  `estado` int(1) NOT NULL DEFAULT '0',
  PRIMARY KEY (`idcarta`)
) ENGINE=InnoDB  DEFAULT CHARSET=latin1 AUTO_INCREMENT=19 ;

--
-- Volcado de datos para la tabla `carta`
--

INSERT INTO `carta` (`idcarta`, `idorg`, `idsede`, `idcategoria`, `fecha`, `estado`) VALUES
(1, 1, 1, 1, '25/02/2017', 0),
(2, 1, 1, 1, '26/02/2017', 0),
(3, 1, 1, 1, '27/02/2017', 0),
(4, 1, 1, 1, '02/03/2017', 0),
(5, 1, 1, 1, '03/03/2017', 0),
(6, 1, 1, 1, '16/03/2017', 0),
(7, 1, 1, 1, '25/03/2017', 0),
(8, 1, 1, 1, '12/04/2017', 0),
(9, 1, 1, 1, '04/05/2017', 0),
(10, 1, 1, 1, '13/05/2017', 0),
(11, 1, 1, 1, '18/05/2017', 0),
(12, 1, 1, 1, '19/05/2017', 0),
(13, 1, 1, 1, '01/06/2017', 0),
(14, 1, 1, 1, '05/06/2017', 0),
(15, 1, 1, 1, '15/06/2017', 0),
(16, 1, 1, 1, '22/08/2017', 0),
(17, 1, 1, 1, '29/08/2017', 0),
(18, 1, 1, 1, '30/08/2017', 0);

-- --------------------------------------------------------

--
-- Estructura de tabla para la tabla `carta_lista`
--

CREATE TABLE IF NOT EXISTS `carta_lista` (
  `idcarta_lista` char(20) NOT NULL,
  `idcarta` int(10) NOT NULL,
  `idseccion` int(10) NOT NULL,
  `iditem` int(10) NOT NULL,
  `precio` varchar(10) NOT NULL,
  `cantidad` char(10) NOT NULL,
  `cant_preparado` char(10) NOT NULL,
  `sec_orden` int(2) NOT NULL,
  `estado` int(1) NOT NULL DEFAULT '0'
) ENGINE=InnoDB DEFAULT CHARSET=latin1;

--
-- Volcado de datos para la tabla `carta_lista`
--

INSERT INTO `carta_lista` (`idcarta_lista`, `idcarta`, `idseccion`, `iditem`, `precio`, `cantidad`, `cant_preparado`, `sec_orden`, `estado`) VALUES
('1160', 18, 9, 60, '2.00', 'ND', 'ND', 1, 0),
('1159', 18, 9, 59, '2.00', 'ND', 'ND', 1, 0),
('112', 18, 10, 2, '10.00', 'ND', 'ND', 2, 0),
('1163', 18, 10, 63, '10.00', 'ND', 'ND', 2, 0),
('1111', 18, 10, 11, '20.00', 'ND', 'ND', 2, 0),
('119', 18, 10, 9, '15.00', '0', '0', 2, 0),
('1161', 18, 10, 61, '10.00', '0', '0', 2, 0),
('1162', 18, 10, 62, '10.00', '0', '0', 2, 0),
('116', 18, 10, 6, '10.00', 'SP', 'SP', 2, 0),
('117', 18, 10, 7, '10.00', 'SP', 'SP', 2, 0),
('118', 18, 10, 8, '20.00', 'SP', 'SP', 2, 0),
('1113', 18, 1, 13, '15.00', 'ND', 'ND', 3, 0),
('113', 18, 1, 3, '15.00', 'ND', 'ND', 3, 0),
('1158', 18, 4, 58, '4.00', 'ND', 'ND', 4, 0),
('1119', 18, 4, 19, '2.00', 'ND', 'ND', 4, 0),
('1118', 18, 4, 18, '1.00', 'ND', 'ND', 4, 0),
('1146', 18, 8, 46, '4.00', 'ND', 'ND', 5, 0),
('1147', 18, 8, 47, '10.00', 'ND', 'ND', 5, 0),
('1145', 18, 8, 45, '2.00', 'ND', 'ND', 5, 0),
('1144', 18, 8, 44, '1.00', 'ND', 'ND', 5, 0),
('1123', 18, 5, 23, '5.00', 'ND', 'ND', 6, 0),
('1143', 18, 5, 43, '5.00', 'ND', 'ND', 6, 0),
('1142', 18, 5, 42, '12.00', 'ND', 'ND', 6, 0),
('1122', 18, 5, 22, '12.00', 'ND', 'ND', 6, 0);

-- --------------------------------------------------------

--
-- Estructura de tabla para la tabla `carta_lista_historial`
--

CREATE TABLE IF NOT EXISTS `carta_lista_historial` (
  `idcarta_lista_historial` int(10) NOT NULL AUTO_INCREMENT,
  `idcarta_lista` int(10) NOT NULL,
  `idcarta` int(10) NOT NULL,
  `idseccion` int(10) NOT NULL,
  `iditem` int(10) NOT NULL,
  `precio` varchar(10) NOT NULL,
  `cantidad` char(10) NOT NULL,
  `cant_preparado` char(10) NOT NULL,
  `sec_orden` int(2) NOT NULL,
  `estado` int(1) NOT NULL DEFAULT '0',
  PRIMARY KEY (`idcarta_lista_historial`)
) ENGINE=InnoDB  DEFAULT CHARSET=latin1 AUTO_INCREMENT=398 ;

--
-- Volcado de datos para la tabla `carta_lista_historial`
--

INSERT INTO `carta_lista_historial` (`idcarta_lista_historial`, `idcarta_lista`, `idcarta`, `idseccion`, `iditem`, `precio`, `cantidad`, `cant_preparado`, `sec_orden`, `estado`) VALUES
(1, 1159, 1, 9, 59, '2.00', '20', '20', 1, 0),
(2, 1160, 1, 9, 60, '2.00', '20', '20', 1, 0),
(3, 112, 1, 10, 2, '10.00', '20', '20', 2, 0),
(4, 1161, 1, 10, 61, '10.00', '20', '20', 2, 0),
(8, 1160, 2, 9, 60, '2.00', '0', '05', 1, 0),
(9, 1159, 2, 9, 59, '2.00', '0', '20', 1, 0),
(10, 112, 2, 10, 2, '10.00', '0', '20', 2, 0),
(11, 1161, 2, 10, 61, '10.00', '0', '19', 2, 0),
(12, 1113, 2, 1, 13, '15.00', '0', '20', 3, 0),
(13, 113, 2, 1, 3, '15.00', '16', '20', 3, 0),
(22, 1160, 3, 9, 60, '2.00', '10', '10', 1, 0),
(23, 1159, 3, 9, 59, '2.00', '10', '10', 1, 0),
(24, 112, 3, 10, 2, '10.00', '10', '10', 2, 0),
(25, 1161, 3, 10, 61, '10.00', '10', '10', 2, 0),
(26, 1113, 3, 1, 13, '15.00', '0', '0', 3, 0),
(27, 113, 3, 1, 3, '15.00', '0', '0', 3, 0),
(67, 1160, 4, 9, 60, '2.00', '0', '10', 1, 0),
(68, 1159, 4, 9, 59, '2.00', '0', '10', 1, 0),
(69, 112, 4, 10, 2, '10.00', '3', '5', 2, 0),
(70, 1111, 4, 10, 11, '20.00', 'SP', 'SP', 2, 0),
(71, 119, 4, 10, 9, '15.00', 'SP', 'SP', 2, 0),
(72, 1161, 4, 10, 61, '10.00', '10', '10', 2, 0),
(73, 1162, 4, 10, 62, '10.00', 'ND', 'ND', 2, 0),
(74, 116, 4, 10, 6, '10.00', 'SP', 'SP', 2, 0),
(75, 117, 4, 10, 7, '10.00', 'SP', 'SP', 2, 0),
(76, 118, 4, 10, 8, '20.00', 'SP', 'SP', 2, 0),
(77, 1113, 4, 1, 13, '15.00', '10', '10', 3, 0),
(78, 113, 4, 1, 3, '15.00', '10', '10', 3, 0),
(79, 1160, 5, 9, 60, '2.00', '10', '10', 1, 0),
(80, 1159, 5, 9, 59, '2.00', '10', '10', 1, 0),
(81, 112, 5, 10, 2, '10.00', '10', '10', 2, 0),
(82, 1111, 5, 10, 11, '20.00', 'SP', 'SP', 2, 0),
(83, 119, 5, 10, 9, '15.00', 'SP', 'SP', 2, 0),
(84, 1161, 5, 10, 61, '10.00', '10', '10', 2, 0),
(85, 1162, 5, 10, 62, '10.00', 'ND', 'ND', 2, 0),
(86, 116, 5, 10, 6, '10.00', 'SP', 'SP', 2, 0),
(87, 117, 5, 10, 7, '10.00', 'SP', 'SP', 2, 0),
(88, 118, 5, 10, 8, '20.00', 'SP', 'SP', 2, 0),
(89, 1113, 5, 1, 13, '15.00', '10', '10', 3, 0),
(90, 113, 5, 1, 3, '15.00', '10', '10', 3, 0),
(121, 1160, 8, 9, 60, '2.00', '0', '0', 1, 0),
(122, 1159, 8, 9, 59, '2.00', '0', '0', 1, 0),
(123, 112, 8, 10, 2, '10.00', '49', '49', 2, 0),
(124, 1111, 8, 10, 11, '20.00', 'SP', 'SP', 2, 0),
(125, 119, 8, 10, 9, '15.00', 'SP', 'SP', 2, 0),
(126, 1161, 8, 10, 61, '10.00', '46', '46', 2, 0),
(127, 1162, 8, 10, 62, '10.00', 'ND', 'ND', 2, 0),
(128, 116, 8, 10, 6, '10.00', '6', '10', 2, 0),
(129, 117, 8, 10, 7, '10.00', '9', '12', 2, 0),
(130, 118, 8, 10, 8, '20.00', '18', '18', 2, 0),
(131, 1113, 8, 1, 13, '15.00', '0', '0', 3, 0),
(132, 113, 8, 1, 3, '15.00', '0', '0', 3, 0),
(133, 1160, 9, 9, 60, '2.00', '20', '20', 1, 0),
(134, 1159, 9, 9, 59, '2.00', '15', '15', 1, 0),
(135, 112, 9, 10, 2, '10.00', '47', '47', 2, 0),
(136, 1111, 9, 10, 11, '20.00', '20', '20', 2, 0),
(137, 119, 9, 10, 9, '15.00', '10', '10', 2, 0),
(138, 1161, 9, 10, 61, '10.00', '46', '46', 2, 0),
(139, 1162, 9, 10, 62, '10.00', '10', '10', 2, 0),
(140, 116, 9, 10, 6, '10.00', '15', '15', 2, 0),
(141, 117, 9, 10, 7, '10.00', '12', '12', 2, 0),
(142, 118, 9, 10, 8, '20.00', '18', '18', 2, 0),
(143, 1113, 9, 1, 13, '15.00', '15', '15', 3, 0),
(144, 113, 9, 1, 3, '15.00', '12', '12', 3, 0),
(160, 1160, 10, 9, 60, '2.00', '-2', 'ND', 1, 0),
(161, 1159, 10, 9, 59, '2.00', '9', '9', 1, 0),
(162, 112, 10, 10, 2, '10.00', '47', '47', 2, 0),
(163, 1163, 10, 10, 63, '10.00', '13', '13', 2, 0),
(164, 1111, 10, 10, 11, '20.00', '19', '19', 2, 0),
(165, 119, 10, 10, 9, '15.00', '10', '10', 2, 0),
(166, 1161, 10, 10, 61, '10.00', '46', '46', 2, 0),
(167, 1162, 10, 10, 62, '10.00', '10', '10', 2, 0),
(168, 116, 10, 10, 6, '10.00', '15', '15', 2, 0),
(169, 117, 10, 10, 7, '10.00', '12', '12', 2, 0),
(170, 118, 10, 10, 8, '20.00', 'SP', 'SP', 2, 0),
(171, 1113, 10, 1, 13, '15.00', '15', '15', 3, 0),
(172, 113, 10, 1, 3, '15.00', '12', '12', 3, 0),
(175, 1160, 12, 9, 60, '2.00', 'ND', 'ND', 1, 0),
(176, 1159, 12, 9, 59, '2.00', '2', '2', 1, 0),
(177, 112, 12, 10, 2, '10.00', '46', '46', 2, 0),
(178, 1163, 12, 10, 63, '10.00', '13', '13', 2, 0),
(179, 1111, 12, 10, 11, '20.00', '19', '19', 2, 0),
(180, 119, 12, 10, 9, '15.00', '10', '10', 2, 0),
(181, 1161, 12, 10, 61, '10.00', '46', '46', 2, 0),
(182, 1162, 12, 10, 62, '10.00', '9', '9', 2, 0),
(183, 116, 12, 10, 6, '10.00', 'SP', 'SP', 2, 0),
(184, 117, 12, 10, 7, '10.00', 'SP', 'SP', 2, 0),
(185, 118, 12, 10, 8, '20.00', 'SP', 'SP', 2, 0),
(186, 1113, 12, 1, 13, '15.00', '15', '15', 3, 0),
(187, 113, 12, 1, 3, '15.00', '12', '12', 3, 0),
(188, 1160, 17, 9, 60, '2.00', 'ND', 'ND', 1, 0),
(189, 1159, 17, 9, 59, '2.00', 'ND', 'ND', 1, 0),
(190, 112, 17, 10, 2, '10.00', 'ND', 'ND', 2, 0),
(191, 1163, 17, 10, 63, '10.00', 'ND', 'ND', 2, 0),
(192, 1111, 17, 10, 11, '20.00', 'ND', 'ND', 2, 0),
(193, 119, 17, 10, 9, '15.00', '0', '0', 2, 0),
(194, 1161, 17, 10, 61, '10.00', '0', '0', 2, 0),
(195, 1162, 17, 10, 62, '10.00', '0', '0', 2, 0),
(196, 116, 17, 10, 6, '10.00', 'SP', 'SP', 2, 0),
(197, 117, 17, 10, 7, '10.00', 'SP', 'SP', 2, 0),
(198, 118, 17, 10, 8, '20.00', 'SP', 'SP', 2, 0),
(199, 1113, 17, 1, 13, '15.00', 'ND', 'ND', 3, 0),
(200, 113, 17, 1, 3, '15.00', 'ND', 'ND', 3, 0),
(201, 1146, 17, 8, 46, '4.00', 'ND', 'ND', 4, 0),
(202, 1147, 17, 8, 47, '10.00', 'ND', 'ND', 4, 0),
(203, 1145, 17, 8, 45, '2.00', 'ND', 'ND', 4, 0),
(204, 1144, 17, 8, 44, '1.00', 'ND', 'ND', 4, 0),
(205, 1123, 17, 5, 23, '5.00', 'ND', 'ND', 5, 0),
(206, 1164, 17, 5, 64, '12.00', 'ND', 'ND', 5, 0),
(207, 1165, 17, 5, 65, '12.00', 'ND', 'ND', 5, 0),
(208, 1158, 17, 4, 58, '4.00', 'ND', 'ND', 6, 0),
(209, 1119, 17, 4, 19, '2.00', 'ND', 'ND', 6, 0),
(210, 1118, 17, 4, 18, '1.00', 'ND', 'ND', 6, 0),
(374, 1160, 18, 9, 60, '2.00', 'ND', 'ND', 1, 0),
(375, 1159, 18, 9, 59, '2.00', 'ND', 'ND', 1, 0),
(376, 112, 18, 10, 2, '10.00', 'ND', 'ND', 2, 0),
(377, 1163, 18, 10, 63, '10.00', 'ND', 'ND', 2, 0),
(378, 1111, 18, 10, 11, '20.00', 'ND', 'ND', 2, 0),
(379, 119, 18, 10, 9, '15.00', '0', '0', 2, 0),
(380, 1161, 18, 10, 61, '10.00', '0', '0', 2, 0),
(381, 1162, 18, 10, 62, '10.00', '0', '0', 2, 0),
(382, 116, 18, 10, 6, '10.00', 'SP', 'SP', 2, 0),
(383, 117, 18, 10, 7, '10.00', 'SP', 'SP', 2, 0),
(384, 118, 18, 10, 8, '20.00', 'SP', 'SP', 2, 0),
(385, 1113, 18, 1, 13, '15.00', 'ND', 'ND', 3, 0),
(386, 113, 18, 1, 3, '15.00', 'ND', 'ND', 3, 0),
(387, 1158, 18, 4, 58, '4.00', 'ND', 'ND', 4, 0),
(388, 1119, 18, 4, 19, '2.00', 'ND', 'ND', 4, 0),
(389, 1118, 18, 4, 18, '1.00', 'ND', 'ND', 4, 0),
(390, 1146, 18, 8, 46, '4.00', 'ND', 'ND', 5, 0),
(391, 1147, 18, 8, 47, '10.00', 'ND', 'ND', 5, 0),
(392, 1145, 18, 8, 45, '2.00', 'ND', 'ND', 5, 0),
(393, 1144, 18, 8, 44, '1.00', 'ND', 'ND', 5, 0),
(394, 1123, 18, 5, 23, '5.00', 'ND', 'ND', 6, 0),
(395, 1143, 18, 5, 43, '5.00', 'ND', 'ND', 6, 0),
(396, 1142, 18, 5, 42, '12.00', 'ND', 'ND', 6, 0),
(397, 1122, 18, 5, 22, '12.00', 'ND', 'ND', 6, 0);

-- --------------------------------------------------------

--
-- Estructura de tabla para la tabla `categoria`
--

CREATE TABLE IF NOT EXISTS `categoria` (
  `idcategoria` int(10) NOT NULL AUTO_INCREMENT,
  `idorg` int(10) NOT NULL,
  `idsede` int(10) NOT NULL,
  `descripcion` varchar(80) NOT NULL,
  `hora_ini` varchar(25) NOT NULL,
  `hora_fin` varchar(25) NOT NULL,
  `visible_x_hora` int(1) NOT NULL DEFAULT '0',
  `estado` int(1) NOT NULL DEFAULT '0',
  PRIMARY KEY (`idcategoria`)
) ENGINE=InnoDB  DEFAULT CHARSET=latin1 AUTO_INCREMENT=2 ;

--
-- Volcado de datos para la tabla `categoria`
--

INSERT INTO `categoria` (`idcategoria`, `idorg`, `idsede`, `descripcion`, `hora_ini`, `hora_fin`, `visible_x_hora`, `estado`) VALUES
(1, 1, 1, 'ALMUERZO', '', '', 0, 0);

-- --------------------------------------------------------

--
-- Estructura de tabla para la tabla `cliente`
--

CREATE TABLE IF NOT EXISTS `cliente` (
  `idcliente` int(10) NOT NULL AUTO_INCREMENT,
  `idorg` int(10) NOT NULL,
  `nombres` varchar(150) NOT NULL,
  `ruc` varchar(20) NOT NULL,
  `direccion` varchar(255) NOT NULL,
  `credito` int(1) NOT NULL DEFAULT '0',
  `estado` int(1) NOT NULL DEFAULT '0',
  PRIMARY KEY (`idcliente`)
) ENGINE=InnoDB  DEFAULT CHARSET=latin1 AUTO_INCREMENT=5 ;

--
-- Volcado de datos para la tabla `cliente`
--

INSERT INTO `cliente` (`idcliente`, `idorg`, `nombres`, `ruc`, `direccion`, `credito`, `estado`) VALUES
(1, 1, 'COLITAS', '', '', 0, 0),
(2, 1, 'JUNIOR', '', '', 0, 0),
(3, 1, 'MARCELO', '', '', 0, 0),
(4, 1, 'JUNIOR', '', '', 0, 0);

-- --------------------------------------------------------

--
-- Estructura de tabla para la tabla `compra`
--

CREATE TABLE IF NOT EXISTS `compra` (
  `idcompra` int(10) NOT NULL AUTO_INCREMENT,
  `idorg` int(10) NOT NULL,
  `idsede` int(10) NOT NULL,
  `idalmacen` int(10) NOT NULL,
  `f_compra` varchar(50) NOT NULL,
  `f_registro` varchar(50) NOT NULL,
  `total` varchar(10) NOT NULL,
  `idproveedor` int(10) NOT NULL,
  `nota_de_compra` varchar(150) NOT NULL,
  `estado` int(1) NOT NULL DEFAULT '0',
  PRIMARY KEY (`idcompra`)
) ENGINE=InnoDB  DEFAULT CHARSET=latin1 AUTO_INCREMENT=58 ;

--
-- Volcado de datos para la tabla `compra`
--

INSERT INTO `compra` (`idcompra`, `idorg`, `idsede`, `idalmacen`, `f_compra`, `f_registro`, `total`, `idproveedor`, `nota_de_compra`, `estado`) VALUES
(1, 1, 1, 2, '30/01/2017', '30/01/2017', '142.70', 1, 'Compras del 30/01/2017', 0),
(2, 1, 1, 2, '31/01/2017', '31/01/2017', '196.50', 2, 'Compras del 31/01/2017', 0),
(3, 1, 1, 3, '31/01/2017', '31/01/2017', '10.00', 3, 'Compras del 31/01/2017', 0),
(4, 1, 1, 2, '01/02/2017', '01/02/2017', '133.00', 4, 'Compras del 01/02/2017', 0),
(5, 1, 1, 2, '01/02/2017', '01/02/2017', '6.50', 5, 'Compras del 01/02/2017', 0),
(6, 1, 1, 3, '01/02/2017', '01/02/2017', '0', 6, 'Compras del 01/02/2017', 0),
(7, 1, 1, 3, '02/02/2017', '02/02/2017', '27.55', 7, 'Compras del 02/02/2017', 0),
(8, 1, 1, 1, '03/02/2017', '03/02/2017', '93.00', 8, 'Compras del 03/02/2017', 0),
(9, 1, 1, 3, '03/02/2017', '03/02/2017', '78.00', 9, 'Compras del 03/02/2017', 0),
(10, 1, 1, 3, '04/02/2017', '04/02/2017', '134.00', 10, 'Compras del 04/02/2017', 0),
(11, 1, 1, 2, '05/02/2017', '05/02/2017', '88.00', 11, 'Compras del 05/02/2017', 0),
(12, 1, 1, 3, '05/02/2017', '05/02/2017', '30.00', 12, 'Compras del 05/02/2017', 0),
(13, 1, 1, 3, '06/02/2017', '06/02/2017', '0', 13, 'Compras del 06/02/2017', 0),
(14, 1, 1, 2, '07/02/2017', '07/02/2017', '108.00', 14, 'Compras del 07/02/2017', 0),
(15, 1, 1, 2, '10/02/2017', '10/02/2017', '68.00', 15, 'Compras del 10/02/2017', 0),
(16, 1, 1, 3, '11/02/2017', '11/02/2017', '384.30', 16, 'Compras del 11/02/2017', 0),
(17, 1, 1, 2, '11/02/2017', '11/02/2017', '91.00', 17, 'Compras del 11/02/2017', 0),
(18, 1, 1, 3, '12/02/2017', '12/02/2017', '140.00', 18, 'Compras del 12/02/2017', 0),
(19, 1, 1, 2, '12/02/2017', '12/02/2017', '244.57', 19, 'Compras del 12/02/2017', 0),
(20, 1, 1, 2, '13/02/2017', '13/02/2017', '44.00', 20, 'Compras del 13/02/2017', 0),
(21, 1, 1, 2, '14/02/2017', '14/02/2017', '24.00', 21, 'Compras del 14/02/2017', 0),
(22, 1, 1, 2, '15/02/2017', '15/02/2017', '132.00', 22, 'Compras del 15/02/2017', 0),
(23, 1, 1, 2, '16/02/2017', '16/02/2017', '116.00', 23, 'Compras del 16/02/2017', 0),
(24, 1, 1, 2, '16/02/2017', '16/02/2017', '13.00', 24, 'Compras del 16/02/2017', 0),
(25, 1, 1, 3, '16/02/2017', '16/02/2017', '15.00', 25, 'Compras del 16/02/2017', 0),
(26, 1, 1, 3, '16/02/2017', '16/02/2017', '86.87', 26, 'Compras del 16/02/2017', 0),
(27, 1, 1, 1, '17/02/2017', '17/02/2017', '108.80', 27, 'Compras del 17/02/2017', 0),
(28, 1, 1, 3, '17/02/2017', '17/02/2017', '108.80', 28, 'Compras del 17/02/2017', 0),
(29, 1, 1, 3, '17/02/2017', '17/02/2017', '87.00', 29, 'Compras del 17/02/2017', 0),
(30, 1, 1, 2, '17/02/2017', '17/02/2017', '68.00', 30, 'Compras del 17/02/2017', 0),
(31, 1, 1, 3, '17/02/2017', '17/02/2017', '13.00', 31, 'Compras del 17/02/2017', 0),
(32, 1, 1, 3, '17/02/2017', '17/02/2017', '0', 32, 'Compras del 17/02/2017', 0),
(33, 1, 1, 2, '18/02/2017', '18/02/2017', '77.11', 33, 'Compras del 18/02/2017', 0),
(34, 1, 1, 3, '18/02/2017', '18/02/2017', '0', 34, 'Compras del 18/02/2017', 0),
(35, 1, 1, 2, '18/02/2017', '18/02/2017', '18.00', 35, 'Compras del 18/02/2017', 0),
(36, 1, 1, 2, '19/02/2017', '19/02/2017', '136.00', 36, 'Compras del 19/02/2017', 0),
(37, 1, 1, 2, '19/02/2017', '19/02/2017', '136.00', 37, 'Compras del 19/02/2017', 0),
(38, 1, 1, 2, '02/03/2017', '02/03/2017', '20.00', 38, 'Compras del 02/03/2017', 0),
(39, 1, 1, 2, '02/03/2017', '02/03/2017', '20.00', 39, 'Compras del 02/03/2017', 0),
(40, 1, 1, 2, '02/03/2017', '02/03/2017', '68.00', 40, 'Compras del 02/03/2017', 0),
(41, 1, 1, 2, '02/03/2017', '02/03/2017', '6.50', 41, 'Compras del 02/03/2017', 0),
(42, 1, 1, 3, '09/05/2017', '09/05/2017', '67.50', 42, 'Compras del 09/05/2017', 0),
(43, 1, 1, 3, '09/05/2017', '09/05/2017', '54.00', 43, '', 0),
(44, 1, 1, 2, '12/05/2017', '12/05/2017', '68.00', 44, 'Compras del 12/05/2017', 0),
(45, 1, 1, 3, '13/05/2017', '13/05/2017', '45.00', 45, 'Compras del 13/05/2017', 0),
(46, 1, 1, 3, '13/05/2017', '13/05/2017', '25.00', 46, '', 0),
(47, 1, 1, 3, '13/05/2017', '13/05/2017', '45.00', 47, 'Compras del 13/05/2017', 0),
(48, 1, 1, 3, '13/05/2017', '13/05/2017', '45.00', 48, '', 0),
(49, 1, 1, 3, '13/05/2017', '13/05/2017', '45.00', 49, 'Compras del 13/05/2017', 0),
(50, 1, 1, 3, '13/05/2017', '13/05/2017', '45.00', 50, '', 0),
(51, 1, 1, 2, '17/05/2017', '17/05/2017', '34.00', 51, 'Compras del 17/05/2017', 0),
(52, 1, 1, 2, '17/05/2017', '17/05/2017', '210.00', 52, '', 0),
(53, 1, 1, 2, '17/05/2017', '17/05/2017', '68.00', 53, '', 0),
(54, 1, 1, 2, '17/05/2017', '17/05/2017', '13.00', 54, '', 0),
(55, 1, 1, 3, '17/05/2017', '17/05/2017', '26.00', 55, '', 0),
(56, 1, 1, 2, '17/05/2017', '17/05/2017', '30.00', 56, 'Compras del 17/05/2017', 0),
(57, 1, 1, 2, '15/06/2017', '15/06/2017', '65.00', 57, 'Compras del 15/06/2017', 0);

--
-- Disparadores `compra`
--
DROP TRIGGER IF EXISTS `kardex_ingreso`;
DELIMITER //
CREATE TRIGGER `kardex_ingreso` AFTER INSERT ON `compra`
 FOR EACH ROW insert into kardex (idoperacion,idorg,idsede,idalmacen,tipo_operacion,fecha,documento)
values (concat('C',new.idcompra), new.idorg,new.idsede,new.idalmacen,1,new.f_compra,new.nota_de_compra)
//
DELIMITER ;

-- --------------------------------------------------------

--
-- Estructura de tabla para la tabla `compra_items`
--

CREATE TABLE IF NOT EXISTS `compra_items` (
  `idcompra_items` int(10) NOT NULL AUTO_INCREMENT,
  `idcompra` int(10) NOT NULL,
  `idproducto` int(10) NOT NULL,
  `cantidad` varchar(10) NOT NULL,
  `punitario` varchar(10) NOT NULL,
  `ptotal` varchar(10) NOT NULL,
  `estado` int(1) NOT NULL DEFAULT '0',
  PRIMARY KEY (`idcompra_items`)
) ENGINE=InnoDB  DEFAULT CHARSET=latin1 AUTO_INCREMENT=140 ;

--
-- Volcado de datos para la tabla `compra_items`
--

INSERT INTO `compra_items` (`idcompra_items`, `idcompra`, `idproducto`, `cantidad`, `punitario`, `ptotal`, `estado`) VALUES
(1, 1, 1, '1000', '0.005', '5.00', 0),
(2, 1, 2, '1000', '0.005', '5.00', 0),
(3, 1, 3, '1000', '0.003', '3.00', 0),
(4, 1, 4, '200', '0.015', '3.00', 0),
(5, 1, 5, '1000', '0.02', '20.00', 0),
(6, 1, 6, '200', '0.015', '3.00', 0),
(7, 1, 7, '2000', '0.016', '32.00', 0),
(8, 1, 8, '1000', '0.034', '34.00', 0),
(9, 1, 9, '1000', '0.034', '34.00', 0),
(10, 1, 10, '17', '0.21764705', '3.70', 0),
(11, 2, 6, '1000', '0.02', '20.00', 0),
(12, 2, 4, '4200', '0.02952380', '124.00', 0),
(13, 2, 43, '2000', '0.003', '6.00', 0),
(14, 2, 44, '2000', '0.0025', '5.00', 0),
(15, 2, 45, '2', '5.5', '11.00', 0),
(16, 2, 46, '3000', '0.005', '15.00', 0),
(17, 2, 47, '1000', '0.0025', '2.50', 0),
(18, 2, 48, '1', '13', '13.00', 0),
(19, 3, 49, '4', '1', '4.00', 0),
(20, 3, 50, '3', '1', '3.00', 0),
(21, 3, 51, '2', '1.5', '3.00', 0),
(22, 4, 8, '1000', '0.034', '34.00', 0),
(23, 4, 6, '1000', '0.02', '20.00', 0),
(24, 4, 7, '3000', '0.016', '48.00', 0),
(25, 4, 43, '4000', '0.003', '12.00', 0),
(26, 4, 44, '1000', '0.0025', '2.50', 0),
(27, 4, 45, '3', '5.5', '16.50', 0),
(28, 5, 10, '30', '0.21666666', '6.50', 0),
(29, 7, 52, '100', '0.092', '9.20', 0),
(30, 7, 18, '6', '0.39999999', '2.40', 0),
(31, 7, 53, '9', '0.49666666', '4.47', 0),
(32, 7, 22, '12', '0.54999999', '6.60', 0),
(33, 7, 54, '6', '0.40666666', '2.44', 0),
(34, 7, 55, '6', '0.40666666', '2.44', 0),
(35, 8, 33, '12', '2.5', '30.00', 0),
(36, 8, 42, '24', '2', '48.00', 0),
(37, 8, 56, '02', '7.5', '15.00', 0),
(38, 9, 33, '12', '2.5', '30.00', 0),
(39, 9, 42, '24', '2', '48.00', 0),
(40, 10, 41, '24', '1.66666666', '40.00', 0),
(41, 10, 40, '12', '1.66666666', '20.00', 0),
(42, 10, 35, '6', '4.5', '27.00', 0),
(43, 10, 34, '6', '4.5', '27.00', 0),
(44, 10, 57, '12', '1.66666666', '20.00', 0),
(45, 11, 8, '1000', '0.034', '34.00', 0),
(46, 11, 9, '1000', '0.034', '34.00', 0),
(47, 11, 5, '1000', '0.02', '20.00', 0),
(48, 12, 58, '9', '3.33333333', '30.00', 0),
(49, 14, 8, '1000', '0.034', '34.00', 0),
(50, 14, 9, '1000', '0.034', '34.00', 0),
(51, 14, 6, '2000', '0.02', '40.00', 0),
(52, 15, 8, '1000', '0.034', '34.00', 0),
(53, 15, 9, '1000', '0.034', '34.00', 0),
(54, 16, 59, '48', '3.75', '180.00', 0),
(55, 16, 61, '12', '3.91666666', '47.00', 0),
(56, 16, 58, '12', '4.5', '54.00', 0),
(57, 16, 62, '12', '4.5', '54.00', 0),
(58, 16, 63, '6', '4', '24.00', 0),
(59, 16, 64, '12', '1.27500000', '15.30', 0),
(60, 16, 65, '12', '0.83333333', '10.00', 0),
(61, 17, 66, '3800', '0.01710526', '65.00', 0),
(62, 17, 67, '2', '13', '26.00', 0),
(63, 18, 40, '12', '1.66666666', '20.00', 0),
(64, 18, 41, '12', '1.66666666', '20.00', 0),
(65, 18, 57, '12', '1.66666666', '20.00', 0),
(66, 18, 39, '30', '0.86666666', '26.00', 0),
(67, 18, 34, '6', '4.5', '27.00', 0),
(68, 18, 35, '6', '4.5', '27.00', 0),
(69, 19, 8, '2000', '0.034', '68.00', 0),
(70, 19, 9, '2000', '0.034', '68.00', 0),
(71, 19, 4, '3000', '0.02952333', '88.57', 0),
(72, 19, 5, '1000', '0.02', '20.00', 0),
(73, 20, 6, '2200', '0.02', '44.00', 0),
(74, 21, 74, '24', '0.375', '9.00', 0),
(75, 21, 75, '12', '1.25', '15.00', 0),
(76, 22, 8, '1000', '0.034', '34.00', 0),
(77, 22, 9, '1000', '0.034', '34.00', 0),
(78, 22, 7, '4000', '0.016', '64.00', 0),
(79, 23, 8, '1000', '0.034', '34.00', 0),
(80, 23, 9, '1000', '0.034', '34.00', 0),
(81, 23, 6, '1400', '0.02', '28.00', 0),
(82, 23, 5, '1000', '0.02', '20.00', 0),
(83, 24, 10, '60', '0.21666666', '13.00', 0),
(84, 25, 11, '13', '1.15384615', '15.00', 0),
(85, 26, 11, '6', '1.15333333', '6.92', 0),
(86, 26, 13, '12', '1.06333333', '12.76', 0),
(87, 26, 18, '6', '0.39999999', '2.40', 0),
(88, 26, 19, '6', '0.39999999', '2.40', 0),
(89, 26, 20, '6', '0.39999999', '2.40', 0),
(90, 26, 24, '30', '0.5', '15.00', 0),
(91, 26, 21, '18', '0.55888888', '10.06', 0),
(92, 26, 17, '9', '0.41666666', '3.75', 0),
(93, 26, 55, '06', '0.40666666', '2.44', 0),
(94, 26, 54, '06', '0.40666666', '2.44', 0),
(95, 26, 22, '06', '0.54999999', '3.30', 0),
(96, 26, 22, '06', '0.54999999', '3.30', 0),
(97, 26, 52, '100', '0.092', '9.20', 0),
(98, 26, 14, '12', '0.875', '10.50', 0),
(99, 27, 32, '60', '0.91333333', '54.80', 0),
(100, 27, 33, '12', '2.5', '30.00', 0),
(101, 27, 42, '12', '2', '24.00', 0),
(102, 28, 32, '60', '0.91333333', '54.80', 0),
(103, 28, 33, '12', '2.5', '30.00', 0),
(104, 28, 42, '12', '2', '24.00', 0),
(105, 29, 40, '12', '1.66666666', '20.00', 0),
(106, 29, 41, '12', '1.66666666', '20.00', 0),
(107, 29, 57, '12', '1.66666666', '20.00', 0),
(108, 29, 34, '6', '4.5', '27.00', 0),
(109, 30, 8, '1000', '0.034', '34.00', 0),
(110, 30, 9, '1000', '0.034', '34.00', 0),
(111, 31, 76, '20', '0.65', '13.00', 0),
(112, 33, 8, '1000', '0.034', '34.00', 0),
(113, 33, 67, '2', '13', '26.00', 0),
(114, 33, 66, '1000', '0.01711', '17.11', 0),
(115, 35, 34, '4', '4.5', '18.00', 0),
(116, 36, 8, '1000', '0.034', '34.00', 0),
(117, 36, 9, '1000', '0.034', '34.00', 0),
(118, 36, 6, '1000', '0.02', '20.00', 0),
(119, 36, 7, '3000', '0.016', '48.00', 0),
(120, 38, 77, '1000', '0.02', '20.00', 0),
(121, 39, 77, '1000', '0.02', '20.00', 0),
(122, 40, 8, '1000', '0.034', '34.00', 0),
(123, 40, 9, '1000', '0.034', '34.00', 0),
(124, 41, 10, '30', '0.21666666', '6.50', 0),
(125, 42, 34, '15', '4.5', '67.50', 0),
(126, 43, 35, '12', '4.5', '54.00', 0),
(127, 45, 59, '12', '3.75', '45.00', 0),
(128, 46, 78, '10', '2.5', '25.00', 0),
(129, 47, 59, '12', '3.75', '45.00', 0),
(132, 50, 59, '12', '3.75', '45.00', 0),
(133, 51, 8, '1000', '0.034', '34.00', 0),
(134, 52, 79, '30', '7', '210.00', 0),
(135, 53, 8, '2000', '0.034', '68.00', 0),
(136, 54, 39, '15', '0.86666666', '13.00', 0),
(137, 55, 39, '30', '0.86666666', '26.00', 0),
(138, 56, 80, '5', '6', '30.00', 0),
(139, 57, 87, '5000', '0.013', '65.00', 0);

--
-- Disparadores `compra_items`
--
DROP TRIGGER IF EXISTS `stock_insert_add_compra`;
DELIMITER //
CREATE TRIGGER `stock_insert_add_compra` AFTER INSERT ON `compra_items`
 FOR EACH ROW IF NOT EXISTS (SELECT idproducto FROM producto_stock WHERE idproducto = new.idproducto AND idalmacen = ( SELECT idalmacen FROM compra WHERE idcompra = new.idcompra ))THEN 
	INSERT INTO producto_stock( idproducto, idalmacen, stock ) VALUES (new.idproducto, (SELECT idalmacen FROM compra WHERE idcompra = new.idcompra), new.cantidad);
ELSE 
	UPDATE producto_stock SET stock = stock + new.cantidad WHERE idproducto = new.idproducto AND idalmacen = ( SELECT idalmacen FROM compra WHERE idcompra = new.idcompra ) ;
END IF
//
DELIMITER ;

-- --------------------------------------------------------

--
-- Estructura de tabla para la tabla `compra_pago`
--

CREATE TABLE IF NOT EXISTS `compra_pago` (
  `idcompra_pago` int(10) NOT NULL AUTO_INCREMENT,
  `idcompra` int(10) NOT NULL,
  `idtipo_pago` int(10) NOT NULL,
  `importe` varchar(10) NOT NULL,
  `estado` int(1) NOT NULL DEFAULT '0',
  PRIMARY KEY (`idcompra_pago`)
) ENGINE=InnoDB  DEFAULT CHARSET=latin1 AUTO_INCREMENT=50 ;

--
-- Volcado de datos para la tabla `compra_pago`
--

INSERT INTO `compra_pago` (`idcompra_pago`, `idcompra`, `idtipo_pago`, `importe`, `estado`) VALUES
(1, 1, 1, '142.70', 0),
(2, 2, 1, '196.50', 0),
(3, 3, 1, '10', 0),
(4, 4, 1, '133', 0),
(5, 5, 1, '6.5', 0),
(6, 7, 1, '27.55', 0),
(7, 8, 1, '93.00', 0),
(8, 9, 1, '78.00', 0),
(9, 10, 1, '134.00', 0),
(10, 11, 1, '88.00', 0),
(11, 12, 1, '30.00', 0),
(12, 14, 1, '108', 0),
(13, 15, 1, '68.00', 0),
(14, 16, 3, '384.30', 0),
(15, 17, 1, '91.00', 0),
(16, 18, 1, '140', 0),
(17, 19, 1, '244.57', 0),
(18, 20, 1, '44', 0),
(19, 21, 1, '24', 0),
(20, 22, 1, '132.00', 0),
(21, 23, 1, '116.00', 0),
(22, 24, 1, '13.00', 0),
(23, 25, 1, '15', 0),
(24, 26, 1, '86.87', 0),
(25, 27, 1, '108.8', 0),
(26, 28, 1, '108.8', 0),
(27, 29, 1, '87.00', 0),
(28, 30, 1, '68.00', 0),
(29, 31, 1, '13', 0),
(30, 33, 1, '77.11', 0),
(31, 35, 1, '18.00', 0),
(32, 36, 1, '136.00', 0),
(33, 38, 1, '20', 0),
(34, 39, 1, '20', 0),
(35, 40, 1, '68.00', 0),
(36, 41, 1, '6.50', 0),
(37, 42, 1, '67.50', 0),
(38, 43, 1, '54.00', 0),
(39, 45, 1, '45.00', 0),
(40, 46, 1, '25.00', 0),
(41, 47, 1, '45.00', 0),
(42, 50, 1, '45.00', 0),
(43, 51, 1, '34.00', 0),
(44, 52, 1, '210.00', 0),
(45, 53, 1, '68.00', 0),
(46, 54, 1, '13.00', 0),
(47, 55, 1, '26.00', 0),
(48, 56, 1, '30.00', 0),
(49, 57, 1, '65.00', 0);

-- --------------------------------------------------------

--
-- Estructura de tabla para la tabla `conf_print`
--

CREATE TABLE IF NOT EXISTS `conf_print` (
  `idconf_print` int(10) NOT NULL AUTO_INCREMENT,
  `idorg` int(10) NOT NULL,
  `idsede` int(10) NOT NULL,
  `ip_print` varchar(80) NOT NULL,
  `num_copias` int(2) NOT NULL,
  `pie_pagina` varchar(200) NOT NULL,
  `logo` varchar(200) NOT NULL,
  `var_margen_iz` int(3) NOT NULL DEFAULT '0' COMMENT 'margen izquierda, default 0',
  `var_size_font` int(1) NOT NULL DEFAULT '0' COMMENT '0=A(x default) 1=B 3=C',
  `estado` int(1) NOT NULL DEFAULT '0',
  PRIMARY KEY (`idconf_print`)
) ENGINE=InnoDB  DEFAULT CHARSET=latin1 AUTO_INCREMENT=2 ;

--
-- Volcado de datos para la tabla `conf_print`
--

INSERT INTO `conf_print` (`idconf_print`, `idorg`, `idsede`, `ip_print`, `num_copias`, `pie_pagina`, `logo`, `var_margen_iz`, `var_size_font`, `estado`) VALUES
(1, 1, 1, '//desa1/print_a', 0, 'Gracias por su preferencia, estamos trabajando  para brindarle un mejor servicio.', '11logo_actualxx.jpg', 45, 1, 0);

-- --------------------------------------------------------

--
-- Estructura de tabla para la tabla `conf_print_adicionales`
--

CREATE TABLE IF NOT EXISTS `conf_print_adicionales` (
  `idconf_print_adicionales` int(10) NOT NULL AUTO_INCREMENT,
  `idconf_print` int(10) NOT NULL,
  `descripcion` varchar(50) NOT NULL,
  `importe` varchar(5) NOT NULL,
  `idtipo_consumo` int(10) NOT NULL,
  `idseccion` int(10) NOT NULL,
  `estado` int(1) NOT NULL DEFAULT '0',
  PRIMARY KEY (`idconf_print_adicionales`)
) ENGINE=InnoDB  DEFAULT CHARSET=latin1 AUTO_INCREMENT=3 ;

--
-- Volcado de datos para la tabla `conf_print_adicionales`
--

INSERT INTO `conf_print_adicionales` (`idconf_print_adicionales`, `idconf_print`, `descripcion`, `importe`, `idtipo_consumo`, `idseccion`, `estado`) VALUES
(1, 1, 'TAPER', '1.00', 2, 10, 0),
(2, 1, 'TAPER', '1.00', 2, 1, 0);

-- --------------------------------------------------------

--
-- Estructura de tabla para la tabla `conf_print_detalle`
--

CREATE TABLE IF NOT EXISTS `conf_print_detalle` (
  `idconf_print_detalle` int(10) NOT NULL AUTO_INCREMENT,
  `idconf_print` int(10) NOT NULL,
  `descripcion` varchar(80) NOT NULL,
  `porcentaje` varchar(4) NOT NULL,
  `estado` int(1) NOT NULL DEFAULT '0',
  PRIMARY KEY (`idconf_print_detalle`)
) ENGINE=InnoDB DEFAULT CHARSET=latin1 AUTO_INCREMENT=1 ;

-- --------------------------------------------------------

--
-- Estructura de tabla para la tabla `conf_print_otros`
--

CREATE TABLE IF NOT EXISTS `conf_print_otros` (
  `conf_print_otros` int(10) NOT NULL AUTO_INCREMENT,
  `idorg` int(10) NOT NULL,
  `idsede` int(10) NOT NULL,
  `idtipo_otro` int(10) NOT NULL COMMENT '-1:precuenta -2:comprobantes -3cierre caja -4listado compras',
  `idimpresora` int(10) NOT NULL,
  `esalmacen` int(1) NOT NULL DEFAULT '0' COMMENT 'si es almacen, como bodega o despacho de cervezas',
  `estado` int(1) NOT NULL DEFAULT '0',
  PRIMARY KEY (`conf_print_otros`)
) ENGINE=InnoDB  DEFAULT CHARSET=latin1 AUTO_INCREMENT=6 ;

--
-- Volcado de datos para la tabla `conf_print_otros`
--

INSERT INTO `conf_print_otros` (`conf_print_otros`, `idorg`, `idsede`, `idtipo_otro`, `idimpresora`, `esalmacen`, `estado`) VALUES
(1, 1, 1, -1, 23, 0, 0),
(2, 1, 1, -2, 23, 0, 0),
(3, 1, 1, 3, 1, 1, 0),
(4, 1, 1, -3, 23, 0, 0),
(5, 1, 1, -4, 23, 0, 0);

-- --------------------------------------------------------

--
-- Estructura de tabla para la tabla `ie_caja`
--

CREATE TABLE IF NOT EXISTS `ie_caja` (
  `idie_caja` int(10) NOT NULL AUTO_INCREMENT,
  `idorg` int(10) NOT NULL,
  `idsede` int(10) NOT NULL,
  `idusuario` int(10) NOT NULL,
  `tipo` int(1) NOT NULL COMMENT '1:ingreso 2:egreso',
  `motivo` varchar(255) NOT NULL,
  `fecha` varchar(30) NOT NULL,
  `monto` varchar(10) NOT NULL,
  `cierre` int(1) NOT NULL DEFAULT '0',
  `estado` int(1) NOT NULL DEFAULT '0',
  PRIMARY KEY (`idie_caja`)
) ENGINE=InnoDB DEFAULT CHARSET=latin1 AUTO_INCREMENT=1 ;

-- --------------------------------------------------------

--
-- Estructura de tabla para la tabla `impresora`
--

CREATE TABLE IF NOT EXISTS `impresora` (
  `idimpresora` int(10) NOT NULL AUTO_INCREMENT,
  `idorg` int(10) NOT NULL,
  `idsede` int(10) NOT NULL,
  `ip` varchar(50) NOT NULL,
  `descripcion` varchar(50) NOT NULL,
  `var_margen_iz` int(3) NOT NULL DEFAULT '0' COMMENT 'margen izquierda para centrar si la letra es peque침a,0 x default',
  `var_size_font` int(1) NOT NULL DEFAULT '0' COMMENT '0=A(x default) 1=B 3=C',
  `local` int(1) NOT NULL DEFAULT '0' COMMENT '1: es impresora local, mandar un copia del pedido',
  `estado` int(1) NOT NULL DEFAULT '0',
  PRIMARY KEY (`idimpresora`)
) ENGINE=InnoDB  DEFAULT CHARSET=latin1 AUTO_INCREMENT=24 ;

--
-- Volcado de datos para la tabla `impresora`
--

INSERT INTO `impresora` (`idimpresora`, `idorg`, `idsede`, `ip`, `descripcion`, `var_margen_iz`, `var_size_font`, `local`, `estado`) VALUES
(1, 1, 1, '//desa1/print_a', 'Impresora Cocina', 48, 1, 0, 1),
(2, 1, 1, '//desa1/print_a', 'Despacho Jugos', 0, 0, 0, 1),
(4, 1, 1, '//desa1/print_a', 'impresora salon', 50, 1, 0, 1),
(5, 1, 1, '//desa1/print_a', 'aaaaaaaaa', 48, 1, 0, 1),
(6, 1, 1, '//desa1/print_a', 'caja_1', 48, 1, 1, 0),
(7, 1, 1, '//desa1/print_a', 'impresora cocina 2', 48, 1, 0, 1),
(8, 0, 0, '', '', 0, 0, 0, 0),
(9, 1, 1, '', '', 0, 0, 0, 1),
(10, 0, 0, '', '', 0, 0, 0, 0),
(11, 0, 0, '', 'qqq', 0, 0, 0, 0),
(12, 1, 1, '', 'qqqq', 0, 0, 0, 1),
(13, 1, 1, '', 'aa', 0, 0, 0, 1),
(14, 0, 0, '', 'eee', 0, 0, 0, 0),
(15, 0, 0, '', 'ww', 0, 0, 0, 0),
(16, 1, 1, '', 'Cocina ', 0, 0, 0, 1),
(17, 1, 1, '', 'cocina para llevar', 0, 0, 0, 1),
(18, 1, 1, '', 'Bar', 0, 0, 0, 1),
(19, 1, 1, '', 'Cocina', 0, 0, 0, 0),
(20, 1, 1, '', 'Jugos', 0, 0, 0, 1),
(21, 1, 1, '', 'Bebidas', 0, 0, 0, 0),
(22, 1, 1, '//desa1/print_a', 'caja', 48, 1, 0, 1),
(23, 1, 1, '//desa1/print_a', 'CAJA', 48, 1, 0, 0);

-- --------------------------------------------------------

--
-- Estructura de tabla para la tabla `item`
--

CREATE TABLE IF NOT EXISTS `item` (
  `iditem` int(10) NOT NULL AUTO_INCREMENT,
  `idorg` int(10) NOT NULL,
  `idsede` int(10) NOT NULL,
  `descripcion` varchar(80) NOT NULL,
  `precio` varchar(10) NOT NULL COMMENT 'ultimo precio',
  `costo` varchar(10) NOT NULL COMMENT 'costo de receta',
  `detalle` varchar(255) NOT NULL,
  `img` varchar(255) NOT NULL,
  `estado` int(1) NOT NULL DEFAULT '0',
  PRIMARY KEY (`iditem`)
) ENGINE=InnoDB  DEFAULT CHARSET=latin1 AUTO_INCREMENT=66 ;

--
-- Volcado de datos para la tabla `item`
--

INSERT INTO `item` (`iditem`, `idorg`, `idsede`, `descripcion`, `precio`, `costo`, `detalle`, `img`, `estado`) VALUES
(1, 1, 1, 'AVISPA JUANE', '8.00', '', '', '', 0),
(2, 1, 1, 'ARROZ CHAUFA REGIONAL', '8.00', '2.88', '', '', 0),
(3, 1, 1, 'LOMITO SALTADO', '7.00', '2.10', '', '', 0),
(4, 1, 1, 'MILANESA', '15.00', '2.24', '', '', 0),
(5, 1, 1, 'PECHUGA A LA PLANCHA', '7.00', '2.24', '', '', 0),
(6, 1, 1, 'TACACHO CON CECINA', '7.00', '3.40', '', '', 0),
(7, 1, 1, 'TACACHO CON CHORIZO', '7.00', '2.50', '', '', 0),
(8, 1, 1, 'TACACHO MIXTO', '7.00', '6.12', '', '', 0),
(9, 1, 1, 'CECINA A LO POBRE', '7.00', '3.62', '', '', 0),
(10, 1, 1, 'PAICHE', '7.00', '2.70', '', '', 0),
(11, 1, 1, 'ASADO DE MAJAS', '20.00', '2.50', '', '', 0),
(12, 1, 1, 'CEVICHE', '1.00', '2.40', '', '', 0),
(13, 1, 1, 'APANADO DE TRUCHA CON PATACONES', '1.00', '', '', '', 0),
(14, 1, 1, 'DESAYUNO REGIONAL', '1.00', '1.92', '', '', 0),
(15, 1, 1, 'CECINA CON HUEVOS REVUELTOS', '1.00', '3.40', '', '', 0),
(16, 1, 1, 'TAMALITOS', '1.00', '', '', '', 0),
(17, 1, 1, 'HUMITAS', '1.00', '', '', '', 0),
(18, 1, 1, 'INFUCIONES', '1.00', '', '', '', 0),
(19, 1, 1, 'CAFE PASADO', '2.00', '', '', '', 0),
(20, 1, 1, 'JARRA MANGO', '12.00', '0.60', '', '', 0),
(21, 1, 1, '1/2 JARRA MANGO', '5.00', '0.30', '', '', 0),
(22, 1, 1, 'JARRA COCONA', '12.00', '1.00', '', '', 0),
(23, 1, 1, '1/2 JARRA DE COCONA', '5.00', '0.50', '', '', 0),
(24, 1, 1, 'JARRA MARACUYA', '12.00', '1.00', '', '', 0),
(25, 1, 1, '1/2 JARRA MARACUYA', '5.00', '0.50', '', '', 0),
(26, 1, 1, 'PORCION DE TACACHO', '5.00', '', '', '', 0),
(27, 1, 1, 'PORCION DE MADURITOS', '5.00', '', '', '', 0),
(28, 1, 1, 'PORCION DE PLATANOS FRITOS', '5.00', '', '', '', 0),
(29, 1, 1, 'PORCION DE PATACONES', '5.00', '', '', '', 0),
(30, 1, 1, 'PORCION DE ARROZ', '5.00', '', '', '', 0),
(31, 1, 1, 'PORCION DE ENSALADA', '5.00', '', '', '', 0),
(32, 1, 1, 'OTROS', '1.00', '', '', '', 0),
(33, 1, 1, 'COCTEL DE CAFE', '5.00', '', '', '', 0),
(34, 1, 1, 'COCTEL DE CACAO', '5.00', '', '', '', 0),
(35, 1, 1, 'COCTEL DE UVA', '5.00', '', '', '', 0),
(36, 1, 1, 'COCACHADO', '7.00', '', '', '', 0),
(37, 1, 1, 'MARIJUANA-CHADO', '8.00', '', '', '', 0),
(38, 1, 1, 'PISCO SOUR', '8.00', '', '', '', 0),
(39, 1, 1, 'COCONA SOUR', '8.00', '', '', '', 0),
(40, 1, 1, 'PIQUEO REGIONAL', '22.00', '', '', '', 0),
(41, 1, 1, 'PIQUEO REGIONAL', '22.00', '5.95', '', '', 0),
(42, 1, 1, 'JARRA GUANABANA', '12.00', '1.00', '', '', 0),
(43, 1, 1, '1/2 JARRA GUANABANA', '5.00', '0.50', '', '', 0),
(44, 1, 1, 'HELADO DE UN SOL', '1.00', '', '', '', 0),
(45, 1, 1, 'HELADO DE DOS SOLES', '2.00', '', '', '', 0),
(46, 1, 1, 'HELADO DE CUATRO SOL', '4.00', '', '', '', 0),
(47, 1, 1, 'HELADO DE DIEZ SOL', '10.00', '', '', '', 0),
(48, 1, 1, 'CRISTAL', '7.00', '', '', '', 0),
(49, 1, 1, 'PILSEN', '7.00', '', '', '', 0),
(50, 1, 1, 'CUSQUEZA NEGRA', '7.00', '', '', '', 0),
(51, 1, 1, 'COSTILLAS AL CILINDRO', '18.00', '4.33', '', '', 0),
(52, 1, 1, 'POLLO AL CILINDRO', '18.00', '5.20', '', '', 0),
(53, 1, 1, '1/2 JARRA DE PI츾ㄸ', '5.00', '', '', '', 0),
(54, 1, 1, '1/2 JARRA DE PI츾ㄸ', '5.00', '', '', '', 0),
(55, 1, 1, 'JARRA DE PI츾ㄸ', '12.00', '', '', '', 0),
(56, 1, 1, 'JUGO SURTIDO', '5.00', '', '', '', 0),
(57, 1, 1, 'JUGO DE PAPAYA', '5.00', '', '', '', 0),
(58, 1, 1, 'CAFE CON LECHE', '4.00', '', '', '', 0),
(59, 1, 1, 'SOPA DE POLLO', '2.00', '', '', '', 0),
(60, 1, 1, 'ARROZ CON LECHE', '2.00', '', '', '', 0),
(61, 1, 1, 'ESCABECHE DE POLLO 칌칌', '10.00', '', '', '', 0),
(62, 1, 1, 'INCHICAPI', '10.00', '', '', '', 0),
(63, 1, 1, 'ASADO DE GALLINA 칌칌', '10.00', '0.00', '', '', 0),
(64, 1, 1, 'JARRA DE COCONA', '12.00', '', '', '', 0),
(65, 1, 1, 'JARRA DE TAPERIBA', '12.00', '', '', '', 0);

-- --------------------------------------------------------

--
-- Estructura de tabla para la tabla `item_cat_kiosko`
--

CREATE TABLE IF NOT EXISTS `item_cat_kiosko` (
  `iditem_cat_kiosko` int(10) NOT NULL AUTO_INCREMENT,
  `idorg` int(10) NOT NULL,
  `idsede` int(10) NOT NULL,
  `descripcion` varchar(80) NOT NULL,
  `estado` int(1) NOT NULL DEFAULT '0',
  PRIMARY KEY (`iditem_cat_kiosko`)
) ENGINE=InnoDB  DEFAULT CHARSET=latin1 AUTO_INCREMENT=5 ;

--
-- Volcado de datos para la tabla `item_cat_kiosko`
--

INSERT INTO `item_cat_kiosko` (`iditem_cat_kiosko`, `idorg`, `idsede`, `descripcion`, `estado`) VALUES
(1, 1, 1, 'CERVEZAS', 0),
(2, 1, 1, 'GASEOSAS', 0),
(3, 1, 1, 'GALLETAS', 0),
(4, 1, 1, 'JUGOS', 0);

-- --------------------------------------------------------

--
-- Estructura de tabla para la tabla `item_ingrediente`
--

CREATE TABLE IF NOT EXISTS `item_ingrediente` (
  `iditem_ingrediente` int(10) NOT NULL AUTO_INCREMENT,
  `iditem` int(10) NOT NULL,
  `idporcion` int(10) NOT NULL DEFAULT '0',
  `descripcion` varchar(80) NOT NULL,
  `cantidad` varchar(10) NOT NULL,
  `costo` varchar(10) NOT NULL,
  `estado` int(1) NOT NULL DEFAULT '0',
  PRIMARY KEY (`iditem_ingrediente`)
) ENGINE=InnoDB  DEFAULT CHARSET=latin1 AUTO_INCREMENT=9 ;

--
-- Volcado de datos para la tabla `item_ingrediente`
--

INSERT INTO `item_ingrediente` (`iditem_ingrediente`, `iditem`, `idporcion`, `descripcion`, `cantidad`, `costo`, `estado`) VALUES
(1, 11, 1, 'MAJAS 120GR', '1', '2.50', 0),
(2, 6, 2, 'CECINA 100GR', '1', '3.40', 0),
(3, 7, 3, 'CHORIZO 34GR', '3', '2.50', 0),
(4, 8, 2, 'CECINA 100GR', '1', '3.40', 0),
(5, 8, 3, 'CHORIZO 34GR', '2', '2.72', 0),
(6, 9, 2, 'CECINA 100GR', '1', '3.40', 0),
(7, 9, 4, 'UN HUEVO', '1', '0.22', 0),
(8, 63, 6, 'GALLINA 200GR', '1', '0.00', 0);

-- --------------------------------------------------------

--
-- Estructura de tabla para la tabla `item_kiosko`
--

CREATE TABLE IF NOT EXISTS `item_kiosko` (
  `iditem_kiosko` int(10) NOT NULL AUTO_INCREMENT,
  `iditem_cat_kiosko` int(10) NOT NULL,
  `stock` varchar(10) NOT NULL,
  `descripcion` varchar(255) NOT NULL,
  `cod_barra` varchar(255) NOT NULL,
  `pventa` varchar(10) NOT NULL,
  `estado` int(1) NOT NULL DEFAULT '0',
  PRIMARY KEY (`iditem_kiosko`)
) ENGINE=InnoDB  DEFAULT CHARSET=latin1 AUTO_INCREMENT=4 ;

--
-- Volcado de datos para la tabla `item_kiosko`
--

INSERT INTO `item_kiosko` (`iditem_kiosko`, `iditem_cat_kiosko`, `stock`, `descripcion`, `cod_barra`, `pventa`, `estado`) VALUES
(1, 1, '10', 'CORONA 525ML', '123456', '7.00', 0),
(2, 1, '20', 'CRISTAL 625ML', '1234567', '6', 0),
(3, 2, '9', 'FANTA PERSONAL', '1234', '2.5', 0);

-- --------------------------------------------------------

--
-- Estructura de tabla para la tabla `kardex`
--

CREATE TABLE IF NOT EXISTS `kardex` (
  `idkardex` int(10) NOT NULL AUTO_INCREMENT,
  `idoperacion` varchar(20) NOT NULL COMMENT 'C: compras P:pedido A:almacenIE',
  `idorg` int(10) NOT NULL,
  `idsede` int(10) NOT NULL,
  `idalmacen` int(10) NOT NULL,
  `tipo_operacion` int(1) NOT NULL COMMENT '1:entrada 2: salida',
  `fecha` varchar(30) NOT NULL,
  `documento` varchar(80) NOT NULL,
  `idusuario` int(10) NOT NULL,
  `estado` int(1) NOT NULL DEFAULT '0',
  PRIMARY KEY (`idkardex`)
) ENGINE=InnoDB  DEFAULT CHARSET=latin1 AUTO_INCREMENT=37 ;

--
-- Volcado de datos para la tabla `kardex`
--

INSERT INTO `kardex` (`idkardex`, `idoperacion`, `idorg`, `idsede`, `idalmacen`, `tipo_operacion`, `fecha`, `documento`, `idusuario`, `estado`) VALUES
(1, '42', 1, 1, 3, 1, '09/05/2017', 'Compras del 09/05/2017', 0, 0),
(2, 'C43', 1, 1, 3, 1, '09/05/2017', '', 0, 0),
(3, 'A9', 1, 1, 1, 2, '09/05/2017', 'AAAA', 0, 0),
(4, 'A10', 1, 1, 1, 2, '09/05/2017', '', 0, 0),
(5, 'A11', 1, 1, 1, 2, '09/05/2017', '', 0, 0),
(6, 'A12', 1, 1, 1, 2, '09/05/2017', '', 0, 0),
(7, 'A13', 1, 1, 1, 2, '09/05/2017', '', 0, 0),
(8, 'A14', 1, 1, 1, 2, '09/05/2017', '', 0, 0),
(9, 'A15', 1, 1, 1, 2, '09/05/2017', '', 0, 0),
(10, 'C44', 1, 1, 2, 1, '12/05/2017', 'Compras del 12/05/2017', 0, 0),
(11, 'C45', 1, 1, 3, 1, '13/05/2017', 'Compras del 13/05/2017', 0, 0),
(12, 'C46', 1, 1, 3, 1, '13/05/2017', '', 0, 0),
(13, 'A16', 1, 1, 3, 2, '13/05/2017', 'VENCIDOS', 0, 0),
(14, 'A17', 1, 1, 3, 2, '13/05/2017', 'AAA', 0, 0),
(15, 'A18', 1, 1, 3, 2, '13/05/2017', 'VENCIMIENTO', 0, 0),
(16, 'A19', 1, 1, 3, 2, '13/05/2017', '', 0, 0),
(17, 'A20', 1, 1, 3, 1, '13/05/2017', 'BONIFICACION DEL PROVEEDOR', 0, 0),
(18, 'A21', 1, 1, 2, 2, '13/05/2017', 'ALMUERZO', 0, 0),
(19, 'A22', 1, 1, 2, 1, '13/05/2017', '', 0, 0),
(20, 'C47', 1, 1, 3, 1, '13/05/2017', 'Compras del 13/05/2017', 0, 0),
(21, 'C48', 1, 1, 3, 1, '13/05/2017', '', 0, 0),
(22, 'C49', 1, 1, 3, 1, '13/05/2017', 'Compras del 13/05/2017', 0, 0),
(23, 'C50', 1, 1, 3, 1, '13/05/2017', '', 0, 0),
(24, 'C51', 1, 1, 2, 1, '17/05/2017', 'Compras del 17/05/2017', 0, 0),
(25, 'C52', 1, 1, 2, 1, '17/05/2017', '', 0, 0),
(26, 'C53', 1, 1, 2, 1, '17/05/2017', '', 0, 0),
(27, 'C54', 1, 1, 2, 1, '17/05/2017', '', 0, 0),
(28, 'C55', 1, 1, 3, 1, '17/05/2017', '', 0, 0),
(29, 'C56', 1, 1, 2, 1, '17/05/2017', 'Compras del 17/05/2017', 0, 0),
(30, 'A23', 1, 1, 3, 1, '18/05/2017', '', 0, 0),
(31, 'A24', 1, 1, 3, 2, '18/05/2017', '', 0, 0),
(32, 'A25', 1, 1, 3, 2, '18/05/2017', 'VENCIMIENTO', 0, 0),
(33, 'A26', 1, 1, 1, 2, '18/05/2017', '', 0, 0),
(34, 'A27', 1, 1, 3, 2, '18/05/2017', '', 0, 0),
(35, 'A28', 1, 1, 3, 2, '18/05/2017', 'BRINDIS POR BUENAS VENTAS', 0, 0),
(36, 'C57', 1, 1, 2, 1, '15/06/2017', 'Compras del 15/06/2017', 0, 0);

-- --------------------------------------------------------

--
-- Estructura de tabla para la tabla `kardex_detalle`
--

CREATE TABLE IF NOT EXISTS `kardex_detalle` (
  `idkardex_detalle` int(10) NOT NULL AUTO_INCREMENT,
  `idkardex` int(10) NOT NULL,
  `idoperacion` varchar(20) NOT NULL COMMENT 'C: compras P:pedido A:almacenIE',
  `idp` int(10) NOT NULL,
  `procede` int(1) NOT NULL COMMENT '0:producto 1: porcion',
  `cantidad` varchar(10) NOT NULL,
  `stock_a_fecha` varchar(10) NOT NULL,
  `valor_unitario` varchar(10) NOT NULL,
  `estado` int(1) NOT NULL DEFAULT '0',
  PRIMARY KEY (`idkardex_detalle`)
) ENGINE=InnoDB  DEFAULT CHARSET=latin1 AUTO_INCREMENT=6 ;

--
-- Volcado de datos para la tabla `kardex_detalle`
--

INSERT INTO `kardex_detalle` (`idkardex_detalle`, `idkardex`, `idoperacion`, `idp`, `procede`, `cantidad`, `stock_a_fecha`, `valor_unitario`, `estado`) VALUES
(1, 0, '42', 34, 0, '15', '115', '4.5', 0),
(2, 0, 'C43', 35, 0, '12', '112', '4.5', 0),
(3, 0, 'A9', 35, 0, '-2', '98', '', 0),
(4, 0, 'A10', 35, 0, '1', '101', '', 0),
(5, 0, 'A13', 35, 0, '-5', '100', '', 0);

-- --------------------------------------------------------

--
-- Estructura de tabla para la tabla `org`
--

CREATE TABLE IF NOT EXISTS `org` (
  `idorg` int(10) NOT NULL AUTO_INCREMENT,
  `nombre` varchar(200) NOT NULL,
  `direccion` varchar(200) NOT NULL,
  `ruc` varchar(20) NOT NULL,
  `telefono` varchar(200) NOT NULL,
  `email` varchar(200) NOT NULL,
  `estado` int(1) NOT NULL DEFAULT '0',
  PRIMARY KEY (`idorg`)
) ENGINE=InnoDB  DEFAULT CHARSET=latin1 AUTO_INCREMENT=2 ;

--
-- Volcado de datos para la tabla `org`
--

INSERT INTO `org` (`idorg`, `nombre`, `direccion`, `ruc`, `telefono`, `email`, `estado`) VALUES
(1, 'SAN CARLOS EIRL', 'JR REYES GUERRA C 7', '', '', '', 0);

-- --------------------------------------------------------

--
-- Estructura de tabla para la tabla `pedido`
--

CREATE TABLE IF NOT EXISTS `pedido` (
  `idpedido` int(10) NOT NULL AUTO_INCREMENT,
  `idorg` int(10) NOT NULL,
  `idsede` int(10) NOT NULL,
  `idcliente` int(10) NOT NULL,
  `idusuario` int(10) NOT NULL,
  `idregistro_pago` int(10) NOT NULL,
  `fecha` varchar(25) NOT NULL,
  `hora` varchar(25) NOT NULL,
  `fecha_hora` datetime NOT NULL,
  `nummesa` int(10) NOT NULL,
  `numpedido` int(10) NOT NULL,
  `correlativo_dia` int(4) NOT NULL,
  `reserva` int(1) NOT NULL DEFAULT '0',
  `referencia` varchar(50) NOT NULL,
  `total` varchar(10) NOT NULL,
  `total_r` char(10) NOT NULL COMMENT 'registra el total del pedido',
  `solo_llevar` int(1) NOT NULL DEFAULT '0',
  `idtipo_consumo` int(10) NOT NULL COMMENT 'firts id',
  `idcategoria` int(10) NOT NULL,
  `tiempo_atencion` varchar(50) NOT NULL COMMENT 'desde pedido hasta despacho',
  `cierre` int(1) NOT NULL DEFAULT '0',
  `motivo_anular` varchar(80) NOT NULL,
  `estado` int(1) NOT NULL DEFAULT '0' COMMENT '0: nuevo, 1:despachado, 2:pagado 3:anulado 4:retirado de despacho',
  PRIMARY KEY (`idpedido`)
) ENGINE=InnoDB  DEFAULT CHARSET=latin1 AUTO_INCREMENT=217 ;

--
-- Volcado de datos para la tabla `pedido`
--

INSERT INTO `pedido` (`idpedido`, `idorg`, `idsede`, `idcliente`, `idusuario`, `idregistro_pago`, `fecha`, `hora`, `fecha_hora`, `nummesa`, `numpedido`, `correlativo_dia`, `reserva`, `referencia`, `total`, `total_r`, `solo_llevar`, `idtipo_consumo`, `idcategoria`, `tiempo_atencion`, `cierre`, `motivo_anular`, `estado`) VALUES
(1, 1, 1, 0, 1, 1, '15/06/2017', '02:27:19', '2017-06-15 02:27:19', 0, 1, 1, 0, '', '20', '', 0, 1, 1, '', 1, 'aaaaaaaaaa', 3),
(2, 1, 1, 0, 1, 2, '16/06/2017', '02:01:37', '2017-06-16 02:01:37', 0, 2, 1, 0, '', '520', '', 0, 1, 1, '', 2, '', 2),
(3, 1, 1, 0, 1, 0, '04/07/2017', '02:36:54', '2017-07-04 02:36:54', 2, 3, 1, 0, '', '0.00', '', 0, 1, 1, '', 2, '', 2),
(4, 1, 1, 0, 1, 0, '04/07/2017', '02:51:14', '2017-07-04 02:51:14', 2, 4, 2, 0, '', '0.00', '', 0, 1, 1, '', 2, '', 2),
(5, 1, 1, 0, 1, 0, '04/07/2017', '03:04:00', '2017-07-04 03:04:00', 2, 5, 3, 0, '', '0.00', '', 0, 1, 1, '', 1, 'por error', 3),
(6, 1, 1, 0, 1, 69, '06/07/2017', '00:48:14', '2017-07-06 00:48:14', 1, 6, 1, 0, '', '2', '', 0, 1, 1, '', 2, '', 2),
(7, 1, 1, 0, 1, 0, '06/07/2017', '00:51:08', '2017-07-06 00:51:08', 4, 7, 2, 0, '', '-15.00', '', 0, 1, 1, '', 1, 'anulado desde registro publico', 3),
(8, 1, 1, 0, 1, 0, '06/07/2017', '00:52:21', '2017-07-06 00:52:21', 2, 8, 3, 0, '', '0.00', '', 0, 1, 1, '', 2, '', 2),
(9, 1, 1, 0, 1, 0, '06/07/2017', '00:53:10', '2017-07-06 00:53:10', 3, 9, 4, 0, '', '0.00', '', 0, 1, 1, '', 2, '', 2),
(10, 1, 1, 0, 1, 3, '06/07/2017', '01:01:15', '2017-07-06 01:01:15', 5, 10, 5, 0, '', '20', '', 0, 1, 1, '', 2, '', 2),
(11, 1, 1, 0, 1, 0, '06/07/2017', '01:02:04', '2017-07-06 01:02:04', 2, 11, 6, 0, '', '0.00', '', 0, 1, 1, '', 2, '', 2),
(12, 1, 1, 0, 1, 0, '06/07/2017', '01:03:26', '2017-07-06 01:03:26', 1, 12, 7, 0, '', '0.00', '', 0, 1, 1, '', 2, '', 2),
(13, 1, 1, 0, 1, 0, '06/07/2017', '01:24:08', '2017-07-06 01:24:08', 2, 13, 8, 0, '', '0.00', '', 0, 1, 1, '', 2, '', 2),
(14, 1, 1, 0, 1, 6, '08/07/2017', '02:46:05', '2017-07-08 02:46:05', 7, 14, 1, 0, '', '10.00', '', 0, 1, 1, '', 2, '', 2),
(15, 1, 1, 0, 1, 0, '08/07/2017', '02:53:38', '2017-07-08 02:53:38', 4, 15, 2, 0, '', '0.00', '', 0, 1, 1, '', 2, '', 2),
(16, 1, 1, 0, 1, 0, '08/07/2017', '23:25:45', '2017-07-08 23:25:45', 20, 16, 3, 0, '', '0.00', '', 0, 1, 1, '', 2, '', 2),
(17, 1, 1, 0, 1, 0, '08/07/2017', '23:26:52', '2017-07-08 23:26:52', 20, 17, 4, 0, '', '0.00', '', 0, 1, 1, '', 2, '', 2),
(18, 1, 1, 0, 1, 12, '08/07/2017', '23:28:10', '2017-07-08 23:28:10', 20, 18, 5, 0, '', '40.00', '', 0, 1, 1, '', 2, '', 2),
(19, 1, 1, 0, 1, 4, '08/07/2017', '23:32:21', '2017-07-08 23:32:21', 12, 19, 6, 0, '', '10', '', 0, 1, 1, '', 2, '', 2),
(20, 1, 1, 0, 1, 8, '08/07/2017', '23:40:31', '2017-07-08 23:40:31', 21, 20, 7, 0, '', '155.00', '', 0, 1, 1, '', 2, '', 2),
(21, 1, 1, 0, 1, 11, '09/07/2017', '03:10:54', '2017-07-09 03:10:54', 20, 21, 1, 0, '', '10.00', '', 0, 1, 1, '', 2, '', 2),
(22, 1, 1, 0, 1, 11, '09/07/2017', '03:12:53', '2017-07-09 03:12:53', 20, 22, 2, 0, '', '50', '', 0, 1, 1, '', 2, '', 2),
(23, 1, 1, 0, 1, 14, '09/07/2017', '03:16:38', '2017-07-09 03:16:38', 20, 23, 3, 0, '', '30.00', '', 0, 1, 1, '', 2, '', 2),
(24, 1, 1, 0, 1, 70, '13/07/2017', '03:29:40', '2017-07-13 03:29:40', 20, 24, 1, 0, '', '40', '', 0, 1, 1, '', 2, '', 2),
(25, 1, 1, 0, 1, 70, '13/07/2017', '03:30:11', '2017-07-13 03:30:11', 20, 25, 2, 0, '', '45', '', 0, 1, 1, '', 2, '', 2),
(26, 1, 1, 0, 1, 0, '13/07/2017', '04:26:30', '2017-07-13 04:26:30', 21, 26, 3, 0, '', '-20.00', '', 0, 1, 1, '', 2, '', 2),
(27, 1, 1, 0, 1, 0, '13/07/2017', '04:26:42', '2017-07-13 04:26:42', 21, 27, 4, 0, '', '0.00', '', 0, 1, 1, '', 2, '', 2),
(28, 1, 1, 0, 1, 0, '13/07/2017', '04:37:52', '2017-07-13 04:37:52', 21, 28, 5, 0, '', '-20.00', '', 0, 1, 1, '', 2, '', 2),
(29, 1, 1, 0, 1, 0, '13/07/2017', '04:38:05', '2017-07-13 04:38:05', 21, 29, 6, 0, '', '0.00', '', 0, 1, 1, '', 2, '', 2),
(30, 1, 1, 0, 1, 0, '13/07/2017', '04:46:59', '2017-07-13 04:46:59', 22, 30, 7, 0, '', '0.00', '', 0, 1, 1, '', 2, '', 2),
(31, 1, 1, 0, 1, 0, '13/07/2017', '04:47:14', '2017-07-13 04:47:14', 22, 31, 8, 0, '', '0.00', '', 0, 1, 1, '', 2, '', 2),
(32, 1, 1, 0, 1, 0, '13/07/2017', '04:47:29', '2017-07-13 04:47:29', 22, 32, 9, 0, '', '0.00', '', 0, 1, 1, '', 2, '', 2),
(33, 1, 1, 0, 1, 0, '13/07/2017', '04:54:04', '2017-07-13 04:54:04', 15, 33, 10, 0, '', '0.00', '', 0, 1, 1, '', 2, '', 2),
(34, 1, 1, 0, 1, 0, '13/07/2017', '04:54:25', '2017-07-13 04:54:25', 15, 34, 11, 0, '', '0.00', '', 0, 1, 1, '', 2, '', 2),
(35, 1, 1, 0, 1, 0, '13/07/2017', '04:54:44', '2017-07-13 04:54:44', 15, 35, 12, 0, '', '0.00', '', 0, 1, 1, '', 2, '', 2),
(36, 1, 1, 0, 1, 0, '13/07/2017', '04:59:45', '2017-07-13 04:59:45', 5, 36, 13, 0, '', '-17.00', '', 0, 1, 1, '', 2, '', 2),
(37, 1, 1, 0, 1, 0, '13/07/2017', '05:23:30', '2017-07-13 05:23:30', 25, 37, 14, 0, '', '0.00', '', 0, 1, 1, '', 2, '', 2),
(38, 1, 1, 0, 1, 0, '13/07/2017', '05:26:30', '2017-07-13 05:26:30', 0, 38, 15, 0, '', '0.00', '', 0, 1, 1, '', 2, '', 2),
(39, 1, 1, 0, 1, 0, '13/07/2017', '05:38:34', '2017-07-13 05:38:34', 0, 39, 16, 0, '', '0.00', '', 0, 1, 1, '', 2, '', 2),
(40, 1, 1, 0, 1, 0, '13/07/2017', '05:38:46', '2017-07-13 05:38:46', 10, 40, 17, 0, '', '0.00', '', 0, 1, 1, '', 2, '', 2),
(41, 1, 1, 0, 1, 0, '13/07/2017', '05:42:30', '2017-07-13 05:42:30', 0, 41, 18, 0, '', '0.00', '', 0, 1, 1, '', 2, '', 2),
(42, 1, 1, 0, 1, 0, '13/07/2017', '05:42:56', '2017-07-13 05:42:56', 12, 42, 19, 0, '', '0.00', '', 0, 1, 1, '', 2, '', 2),
(43, 1, 1, 0, 1, 0, '13/07/2017', '05:43:39', '2017-07-13 05:43:39', 12, 43, 20, 0, '', '0.00', '', 0, 1, 1, '', 2, '', 2),
(44, 1, 1, 0, 1, 0, '13/07/2017', '05:48:39', '2017-07-13 05:48:39', 15, 44, 21, 0, '', '0.00', '', 0, 1, 1, '', 2, '', 2),
(45, 1, 1, 0, 1, 0, '13/07/2017', '05:56:22', '2017-07-13 05:56:22', 0, 45, 22, 0, '', '0.00', '', 0, 1, 1, '', 2, '', 2),
(46, 1, 1, 0, 1, 0, '13/07/2017', '05:56:49', '2017-07-13 05:56:49', 20, 46, 23, 0, '', '-10.00', '', 0, 1, 1, '', 2, '', 2),
(47, 1, 1, 0, 1, 0, '13/07/2017', '07:12:35', '2017-07-13 07:12:35', 18, 47, 24, 0, '', '0.00', '', 0, 1, 1, '', 2, '', 2),
(48, 1, 1, 0, 1, 0, '13/07/2017', '07:15:08', '2017-07-13 07:15:08', 19, 48, 25, 0, '', '0.00', '', 0, 1, 1, '', 2, '', 2),
(49, 1, 1, 0, 1, 0, '13/07/2017', '07:15:28', '2017-07-13 07:15:28', 19, 49, 26, 0, '', '0.00', '', 0, 1, 1, '', 2, '', 2),
(50, 1, 1, 0, 1, 0, '13/07/2017', '07:15:42', '2017-07-13 07:15:42', 19, 50, 27, 0, '', '0.00', '', 0, 1, 1, '', 2, '', 2),
(51, 1, 1, 0, 1, 0, '13/07/2017', '07:16:00', '2017-07-13 07:16:00', 0, 51, 28, 0, '', '0.00', '', 0, 1, 1, '', 2, '', 2),
(52, 1, 1, 0, 1, 0, '13/07/2017', '07:19:32', '2017-07-13 07:19:32', 9, 52, 29, 0, '', '0.00', '', 0, 1, 1, '', 2, '', 2),
(53, 1, 1, 0, 1, 0, '13/07/2017', '07:19:45', '2017-07-13 07:19:45', 9, 53, 30, 0, '', '0.00', '', 0, 1, 1, '', 2, '', 2),
(54, 1, 1, 0, 1, 0, '13/07/2017', '07:20:05', '2017-07-13 07:20:05', 9, 54, 31, 0, '', '0.00', '', 0, 1, 1, '', 2, '', 2),
(55, 1, 1, 0, 1, 0, '13/07/2017', '07:20:15', '2017-07-13 07:20:15', 9, 55, 32, 0, '', '0.00', '', 0, 1, 1, '', 2, '', 2),
(56, 1, 1, 0, 1, 0, '13/07/2017', '07:24:51', '2017-07-13 07:24:51', 10, 56, 33, 0, '', '0.00', '', 0, 1, 1, '', 2, '', 2),
(57, 1, 1, 0, 1, 0, '17/07/2017', '23:21:26', '2017-07-17 23:21:26', 2, 57, 1, 0, '', '0.00', '', 0, 1, 1, '', 2, '', 2),
(58, 1, 1, 0, 1, 0, '22/07/2017', '00:43:46', '2017-07-22 00:43:46', 1, 58, 1, 0, '', '0.00', '', 0, 1, 1, '', 2, '', 2),
(59, 1, 1, 0, 1, 0, '22/07/2017', '00:47:20', '2017-07-22 00:47:20', 7, 59, 2, 0, '', '0.00', '', 0, 1, 1, '', 2, '', 2),
(60, 1, 1, 0, 1, 0, '05/08/2017', '16:41:01', '2017-08-05 16:41:01', 1, 60, 1, 0, '', '0.00', '', 0, 1, 1, '', 2, '', 2),
(61, 1, 1, 0, 1, 0, '05/08/2017', '16:42:17', '2017-08-05 16:42:17', 1, 61, 2, 0, '', '0.00', '', 0, 1, 1, '', 2, '', 2),
(62, 1, 1, 0, 1, 0, '05/08/2017', '22:10:36', '2017-08-05 22:10:36', 2, 62, 3, 0, '', '0.00', '', 0, 1, 1, '', 2, '', 2),
(63, 1, 1, 0, 1, 0, '14/08/2017', '21:39:44', '2017-08-14 21:39:44', 0, 63, 1, 0, '', '-0.50', '', 0, 1, 1, '', 2, '', 2),
(64, 1, 1, 0, 1, 0, '14/08/2017', '21:41:17', '2017-08-14 21:41:17', 5, 64, 2, 0, 'rapido', '0.00', '', 0, 1, 1, '', 2, '', 2),
(65, 1, 1, 0, 1, 0, '18/08/2017', '17:24:59', '2017-08-18 17:24:59', 0, 65, 1, 0, '', '0.00', '', 0, 1, 1, '', 2, '', 2),
(66, 1, 1, 0, 1, 0, '18/08/2017', '17:26:32', '2017-08-18 17:26:32', 0, 66, 2, 0, '', '0.00', '', 0, 1, 1, '', 2, '', 2),
(67, 1, 1, 0, 1, 0, '18/08/2017', '17:26:35', '2017-08-18 17:26:35', 0, 67, 3, 0, '', '0.00', '', 0, 1, 1, '', 2, '', 2),
(68, 1, 1, 0, 1, 0, '18/08/2017', '17:30:58', '2017-08-18 17:30:58', 4, 68, 4, 0, '', '0.00', '', 0, 1, 1, '', 2, '', 2),
(69, 1, 1, 0, 1, 0, '18/08/2017', '17:31:08', '2017-08-18 17:31:08', 4, 69, 5, 0, '', '0.00', '', 0, 1, 1, '', 2, '', 2),
(70, 1, 1, 0, 1, 0, '18/08/2017', '17:31:31', '2017-08-18 17:31:31', 4, 70, 6, 0, '', '0.00', '', 0, 1, 1, '', 2, '', 2),
(71, 1, 1, 0, 1, 0, '18/08/2017', '17:31:45', '2017-08-18 17:31:45', 4, 71, 7, 0, '', '0.00', '', 0, 1, 1, '', 2, '', 2),
(72, 1, 1, 0, 1, 0, '18/08/2017', '17:31:47', '2017-08-18 17:31:47', 4, 72, 8, 0, '', '0.00', '', 0, 1, 1, '', 2, '', 2),
(73, 1, 1, 0, 1, 0, '18/08/2017', '17:31:49', '2017-08-18 17:31:49', 4, 73, 9, 0, '', '0.00', '', 0, 1, 1, '', 2, '', 2),
(74, 1, 1, 0, 1, 0, '18/08/2017', '17:31:49', '2017-08-18 17:31:49', 4, 74, 10, 0, '', '0.00', '', 0, 1, 1, '', 2, '', 2),
(75, 1, 1, 0, 1, 0, '18/08/2017', '17:31:50', '2017-08-18 17:31:50', 4, 75, 11, 0, '', '0.00', '', 0, 1, 1, '', 2, '', 2),
(76, 1, 1, 0, 1, 0, '18/08/2017', '17:31:50', '2017-08-18 17:31:50', 4, 76, 12, 0, '', '0.00', '', 0, 1, 1, '', 2, '', 2),
(77, 1, 1, 0, 1, 0, '18/08/2017', '17:31:50', '2017-08-18 17:31:50', 4, 77, 13, 0, '', '0.00', '', 0, 1, 1, '', 2, '', 2),
(78, 1, 1, 0, 1, 0, '18/08/2017', '17:38:15', '2017-08-18 17:38:15', 4, 78, 14, 0, '', '0.00', '', 0, 1, 1, '', 2, '', 2),
(79, 1, 1, 0, 1, 0, '18/08/2017', '17:39:17', '2017-08-18 17:39:17', 4, 79, 15, 0, '', '0.00', '', 0, 1, 1, '', 2, '', 2),
(80, 1, 1, 0, 1, 0, '18/08/2017', '17:40:52', '2017-08-18 17:40:52', 4, 80, 16, 0, '', '0.00', '', 0, 1, 1, '', 2, '', 2),
(81, 1, 1, 0, 1, 0, '18/08/2017', '20:06:25', '2017-08-18 20:06:25', 4, 81, 17, 0, '', '0.00', '', 0, 1, 1, '', 2, '', 2),
(82, 1, 1, 0, 1, 0, '18/08/2017', '20:26:45', '2017-08-18 20:26:45', 2, 82, 18, 0, '', '0.00', '', 0, 1, 1, '', 2, '', 2),
(83, 1, 1, 0, 1, 0, '18/08/2017', '20:26:55', '2017-08-18 20:26:55', 0, 83, 19, 0, '', '4', '', 1, 2, 1, '', 2, '', 2),
(84, 1, 1, 0, 1, 0, '18/08/2017', '20:38:05', '2017-08-18 20:38:05', 1, 84, 20, 0, '', '0.00', '', 0, 1, 1, '', 2, '', 2),
(85, 1, 1, 0, 1, 0, '19/08/2017', '01:20:35', '2017-08-19 01:20:35', 2, 85, 1, 0, '', '0.00', '', 0, 1, 1, '', 2, '', 2),
(86, 1, 1, 0, 1, 0, '19/08/2017', '01:20:44', '2017-08-19 01:20:44', 0, 86, 2, 0, '', '0.00', '', 1, 2, 1, '', 2, '', 2),
(87, 1, 1, 0, 1, 0, '19/08/2017', '01:51:10', '2017-08-19 01:51:10', 1, 87, 3, 0, '', '0.00', '', 0, 1, 1, '', 2, '', 2),
(88, 1, 1, 0, 1, 0, '19/08/2017', '01:51:36', '2017-08-19 01:51:36', 0, 88, 4, 0, '', '0.00', '', 1, 2, 1, '', 2, '', 2),
(89, 1, 1, 0, 1, 0, '19/08/2017', '01:52:15', '2017-08-19 01:52:15', 2, 89, 5, 0, '', '0.00', '', 0, 1, 1, '', 2, '', 2),
(90, 1, 1, 0, 1, 0, '19/08/2017', '01:52:24', '2017-08-19 01:52:24', 0, 90, 6, 0, '', '0.00', '', 1, 2, 1, '', 2, '', 2),
(91, 1, 1, 0, 1, 0, '19/08/2017', '03:33:41', '2017-08-19 03:33:41', 2, 91, 7, 0, '', '0.00', '', 0, 1, 1, '', 2, '', 2),
(92, 1, 1, 0, 1, 0, '19/08/2017', '03:34:47', '2017-08-19 03:34:47', 1, 92, 8, 0, '', '0.00', '', 0, 1, 1, '', 2, '', 2),
(93, 1, 1, 0, 1, 0, '22/08/2017', '03:07:37', '2017-08-22 03:07:37', 5, 93, 1, 0, '', '0.00', '', 0, 1, 1, '', 2, '', 2),
(94, 1, 1, 0, 1, 0, '22/08/2017', '03:08:02', '2017-08-22 03:08:02', 6, 94, 2, 0, '', '25', '', 0, 1, 1, '', 2, '', 2),
(95, 1, 1, 0, 1, 0, '22/08/2017', '12:02:36', '2017-08-22 12:02:36', 20, 95, 3, 0, 'SR. JUAN PEREZ', '16', '', 0, 1, 1, '', 2, '', 2),
(96, 1, 1, 0, 1, 0, '29/08/2017', '06:56:25', '2017-08-29 06:56:25', 20, 96, 1, 0, '', '20', '', 0, 1, 1, '', 2, '', 2),
(97, 1, 1, 0, 1, 0, '29/08/2017', '06:57:49', '2017-08-29 06:57:49', 10, 97, 2, 0, '', '40', '', 0, 1, 1, '', 2, '', 2),
(98, 1, 1, 0, 1, 0, '29/08/2017', '07:01:36', '2017-08-29 07:01:36', 8, 98, 3, 0, '', '42', '', 0, 1, 1, '', 2, '', 2),
(99, 1, 1, 0, 1, 0, '29/08/2017', '17:30:41', '2017-08-29 17:30:41', 15, 99, 4, 0, '', '30', '', 0, 1, 1, '', 2, '', 2),
(100, 1, 1, 0, 1, 0, '29/08/2017', '17:44:57', '2017-08-29 17:44:57', 11, 100, 5, 0, '', '45', '', 0, 1, 1, '', 2, '', 2),
(101, 1, 1, 0, 1, 0, '29/08/2017', '17:53:02', '2017-08-29 17:53:02', 5, 101, 6, 0, '', '30', '', 0, 1, 1, '', 2, '', 2),
(102, 1, 1, 0, 1, 0, '29/08/2017', '17:53:33', '2017-08-29 17:53:33', 12, 102, 7, 0, '', '39', '', 0, 1, 1, '', 2, '', 2),
(103, 1, 1, 0, 1, 0, '29/08/2017', '17:57:23', '2017-08-29 17:57:23', 13, 103, 8, 0, '', '276', '', 0, 1, 1, '', 2, '', 2),
(104, 1, 1, 0, 1, 0, '29/08/2017', '19:39:41', '2017-08-29 19:39:41', 14, 104, 9, 0, '', '34', '', 0, 1, 1, '', 2, '', 2),
(105, 1, 1, 0, 1, 0, '29/08/2017', '19:41:24', '2017-08-29 19:41:24', 17, 105, 10, 0, '', '75', '', 0, 1, 1, '', 2, '', 2),
(106, 1, 1, 0, 1, 0, '29/08/2017', '19:42:32', '2017-08-29 19:42:32', 18, 106, 11, 0, '', '63', '', 0, 2, 1, '', 2, '', 2),
(107, 1, 1, 0, 1, 0, '29/08/2017', '19:42:57', '2017-08-29 19:42:57', 18, 107, 12, 0, '', '12', '', 0, 1, 1, '', 2, '', 2),
(108, 1, 1, 0, 1, 0, '29/08/2017', '19:46:26', '2017-08-29 19:46:26', 19, 108, 13, 0, '', '58', '', 0, 1, 1, '', 2, '', 2),
(109, 1, 1, 0, 1, 0, '30/08/2017', '11:01:20', '2017-08-30 11:01:20', 2, 109, 1, 0, '', '81', '', 0, 1, 1, '', 2, '', 2),
(110, 1, 1, 0, 1, 0, '01/09/2017', '00:19:30', '2017-09-01 00:19:30', 5, 110, 1, 0, '', '54', '', 0, 1, 1, '', 2, '', 2),
(111, 1, 1, 0, 1, 136, '01/09/2017', '00:23:50', '2017-09-01 00:23:50', 6, 111, 2, 0, '', '0', '', 0, 1, 1, '', 2, '', 2),
(112, 1, 1, 0, 1, 183, '01/09/2017', '00:33:43', '2017-09-01 00:33:43', 8, 112, 3, 0, '', '0', '', 0, 1, 1, '', 2, '', 2),
(113, 1, 1, 0, 1, 186, '01/09/2017', '00:38:50', '2017-09-01 00:38:50', 9, 113, 4, 0, '', '0', '', 0, 1, 1, '', 2, '', 2),
(114, 1, 1, 0, 1, 0, '01/09/2017', '00:39:22', '2017-09-01 00:39:22', 10, 114, 5, 0, '', '-20', '', 0, 1, 1, '', 1, 'ccc', 3),
(115, 1, 1, 0, 1, 0, '01/09/2017', '02:19:27', '2017-09-01 02:19:27', 14, 115, 6, 0, '', '1', '', 0, 2, 1, '', 1, 'aaa', 3),
(116, 1, 1, 0, 1, 174, '01/09/2017', '16:56:22', '2017-09-01 16:56:22', 5, 116, 7, 0, '', '0', '', 0, 1, 1, '', 2, '', 2),
(117, 1, 1, 0, 1, 183, '01/09/2017', '16:59:04', '2017-09-01 16:59:04', 8, 117, 8, 0, '', '0', '', 0, 1, 1, '', 2, '', 2),
(118, 1, 1, 0, 1, 0, '01/09/2017', '17:04:10', '2017-09-01 17:04:10', 6, 118, 9, 0, '', '22', '', 0, 1, 1, '', 2, '', 4),
(119, 1, 1, 0, 1, 186, '01/09/2017', '17:08:30', '2017-09-01 17:08:30', 9, 119, 10, 0, '', '0', '', 0, 1, 1, '', 2, '', 2),
(120, 1, 1, 0, 1, 183, '04/09/2017', '00:31:19', '2017-09-04 00:31:19', 8, 120, 1, 0, '', '0', '', 0, 1, 1, '', 2, '', 2),
(121, 1, 1, 0, 1, 0, '04/09/2017', '01:01:59', '2017-09-04 01:01:59', 8, 121, 2, 0, '', '24', '', 0, 1, 1, '', 1, 'xxaaa', 3),
(122, 1, 1, 0, 1, 174, '04/09/2017', '01:03:10', '2017-09-04 01:03:10', 5, 122, 3, 0, '', '0', '', 0, 1, 1, '', 2, '', 2),
(123, 1, 1, 0, 1, 174, '04/09/2017', '01:03:22', '2017-09-04 01:03:22', 5, 123, 4, 0, '', '0', '', 0, 1, 1, '', 2, '', 2),
(124, 1, 1, 0, 1, 174, '04/09/2017', '01:03:42', '2017-09-04 01:03:42', 5, 124, 5, 0, '', '0', '', 0, 1, 1, '', 2, '', 2),
(125, 1, 1, 0, 1, 184, '04/09/2017', '01:04:13', '2017-09-04 01:04:13', 0, 125, 6, 0, '', '0', '', 0, 1, 1, '', 2, '', 2),
(126, 1, 1, 0, 1, 174, '04/09/2017', '01:04:54', '2017-09-04 01:04:54', 5, 126, 7, 0, '', '0', '', 0, 1, 1, '', 2, '', 2),
(127, 1, 1, 0, 1, 0, '04/09/2017', '01:07:12', '2017-09-04 01:07:12', 5, 127, 8, 0, '', '15', '', 0, 1, 1, '', 2, '', 4),
(128, 1, 1, 0, 1, 0, '04/09/2017', '01:07:31', '2017-09-04 01:07:31', 8, 128, 9, 0, '', '-71.00', '', 0, 1, 1, '', 2, '', 2),
(129, 1, 1, 0, 1, 174, '10/09/2017', '01:00:00', '2017-09-10 01:00:00', 5, 129, 1, 0, '', '0', '', 0, 1, 1, '', 2, '', 2),
(130, 1, 1, 0, 1, 134, '10/09/2017', '01:10:39', '2017-09-10 01:10:39', 12, 130, 2, 0, '', '0', '', 0, 1, 1, '', 2, '', 2),
(131, 1, 1, 0, 1, 183, '10/09/2017', '02:43:03', '2017-09-10 02:43:03', 8, 131, 3, 0, '', '0', '', 0, 1, 1, '', 2, '', 2),
(132, 1, 1, 0, 1, 173, '10/09/2017', '02:56:39', '2017-09-10 02:56:39', 13, 132, 4, 0, '', '0', '', 0, 1, 1, '', 2, '', 2),
(133, 1, 1, 0, 1, 172, '11/09/2017', '00:47:37', '2017-09-11 00:47:37', 2, 133, 1, 0, '', '0', '', 0, 1, 1, '', 2, '', 2),
(134, 1, 1, 0, 1, 131, '11/09/2017', '02:03:22', '2017-09-11 02:03:22', 2, 134, 2, 0, 'AAAAAAAA', '-15', '', 0, 1, 1, '', 1, 'bbb', 3),
(135, 1, 1, 0, 1, 183, '11/09/2017', '02:50:59', '2017-09-11 02:50:59', 8, 135, 3, 1, '', '0', '', 0, 1, 1, '', 2, '', 2),
(136, 1, 1, 0, 1, 186, '11/09/2017', '04:13:28', '2017-09-11 03:34:12', 9, 136, 4, 0, 'SERVIR A LA 1PM', '0', '', 0, 1, 1, '', 2, '', 2),
(143, 1, 1, 0, 1, 137, '13/09/2017', '14:55:58', '2017-09-13 14:55:58', 20, 137, 1, 0, '', '0', '12', 0, 1, 1, '', 2, '', 2),
(144, 1, 1, 0, 1, 138, '13/09/2017', '14:56:43', '2017-09-13 14:56:43', 21, 138, 2, 0, '', '0', '12', 0, 1, 1, '', 2, '', 2),
(145, 1, 1, 0, 1, 177, '13/09/2017', '14:59:24', '2017-09-13 14:59:24', 22, 139, 3, 0, '', '0', '40', 0, 1, 1, '', 2, '', 2),
(146, 1, 1, 0, 1, 177, '13/09/2017', '14:59:45', '2017-09-13 14:59:45', 22, 140, 4, 0, '', '0', '45', 0, 1, 1, '', 2, '', 2),
(147, 1, 1, 0, 1, 0, '13/09/2017', '23:29:23', '2017-09-13 23:29:23', 5, 141, 5, 0, '', '10', '10', 0, 1, 1, '', 1, 'xx', 3),
(148, 1, 1, 0, 1, 0, '13/09/2017', '23:29:32', '2017-09-13 23:29:32', 0, 142, 6, 0, '', '10', '10', 0, 1, 1, '', 2, '', 2),
(149, 1, 1, 0, 1, 0, '13/09/2017', '23:30:20', '2017-09-13 23:30:20', 0, 143, 7, 0, '', '10', '10', 0, 1, 1, '', 2, '', 2),
(150, 1, 1, 0, 1, 0, '13/09/2017', '23:30:59', '2017-09-13 23:30:59', 0, 144, 8, 0, '', '10', '10', 0, 1, 1, '', 2, '', 2),
(151, 1, 1, 0, 1, 0, '13/09/2017', '23:36:29', '2017-09-13 23:36:29', 0, 145, 9, 0, '', '10', '10', 0, 1, 1, '', 2, '', 2),
(152, 1, 1, 0, 1, 0, '13/09/2017', '23:38:28', '2017-09-13 23:38:28', 0, 146, 10, 0, '', '10', '10', 0, 1, 1, '', 2, '', 2),
(153, 1, 1, 0, 1, 0, '13/09/2017', '23:41:39', '2017-09-13 23:41:39', 0, 147, 11, 0, '', '10', '10', 0, 1, 1, '', 2, '', 2),
(154, 1, 1, 0, 1, 0, '13/09/2017', '23:43:30', '2017-09-13 23:43:30', 0, 148, 12, 0, '', '10', '10', 0, 1, 1, '', 2, '', 2),
(155, 1, 1, 0, 1, 0, '13/09/2017', '23:45:30', '2017-09-13 23:45:30', 0, 149, 13, 0, '', '10', '10', 0, 1, 1, '', 2, '', 2),
(156, 1, 1, 0, 1, 0, '13/09/2017', '23:46:50', '2017-09-13 23:46:50', 0, 150, 14, 0, '', '10', '10', 0, 1, 1, '', 2, '', 2),
(157, 1, 1, 0, 1, 0, '13/09/2017', '23:47:20', '2017-09-13 23:47:20', 0, 151, 15, 0, '', '10', '10', 0, 1, 1, '', 2, '', 2),
(158, 1, 1, 0, 1, 0, '13/09/2017', '23:49:32', '2017-09-13 23:49:32', 0, 152, 16, 0, '', '10', '10', 0, 1, 1, '', 2, '', 2),
(159, 1, 1, 0, 1, 0, '13/09/2017', '23:51:14', '2017-09-13 23:51:14', 0, 153, 17, 0, '', '4', '4', 0, 1, 1, '', 2, '', 2),
(160, 1, 1, 0, 1, 0, '13/09/2017', '23:53:37', '2017-09-13 23:53:37', 0, 154, 18, 0, '', '10', '10', 0, 1, 1, '', 2, '', 2),
(161, 1, 1, 0, 1, 0, '13/09/2017', '23:55:13', '2017-09-13 23:55:13', 0, 155, 19, 0, '', '20', '20', 0, 1, 1, '', 2, '', 2),
(162, 1, 1, 0, 1, 0, '13/09/2017', '23:55:36', '2017-09-13 23:55:36', 0, 156, 20, 0, '', '10', '10', 0, 1, 1, '', 2, '', 2),
(163, 1, 1, 0, 1, 0, '13/09/2017', '23:56:37', '2017-09-13 23:56:37', 0, 157, 21, 0, '', '10', '10', 0, 1, 1, '', 2, '', 2),
(164, 1, 1, 0, 1, 0, '13/09/2017', '23:57:36', '2017-09-13 23:57:36', 0, 158, 22, 0, '', '10', '10', 0, 1, 1, '', 2, '', 2),
(165, 1, 1, 0, 1, 0, '13/09/2017', '23:58:54', '2017-09-13 23:58:54', 0, 159, 23, 0, '', '10', '10', 0, 1, 1, '', 2, '', 2),
(166, 1, 1, 0, 1, 0, '13/09/2017', '23:59:41', '2017-09-13 23:59:41', 0, 160, 24, 0, '', '10', '10', 0, 1, 1, '', 2, '', 2),
(167, 1, 1, 0, 1, 0, '14/09/2017', '00:00:56', '2017-09-14 00:00:56', 0, 161, 1, 0, '', '10', '10', 0, 1, 1, '', 2, '', 2),
(168, 1, 1, 0, 1, 0, '14/09/2017', '00:02:27', '2017-09-14 00:02:27', 0, 162, 2, 0, '', '10', '10', 0, 1, 1, '', 2, '', 2),
(169, 1, 1, 0, 1, 0, '14/09/2017', '00:03:24', '2017-09-14 00:03:24', 0, 163, 3, 0, '', '4', '4', 0, 1, 1, '', 2, '', 2),
(170, 1, 1, 0, 1, 0, '14/09/2017', '00:04:39', '2017-09-14 00:04:39', 0, 164, 4, 0, '', '4', '4', 0, 1, 1, '', 2, '', 2),
(171, 1, 1, 0, 1, 0, '14/09/2017', '00:05:29', '2017-09-14 00:05:29', 0, 165, 5, 0, '', '10', '10', 0, 1, 1, '', 2, '', 2),
(172, 1, 1, 0, 1, 0, '14/09/2017', '00:06:18', '2017-09-14 00:06:18', 0, 166, 6, 0, '', '10', '10', 0, 1, 1, '', 2, '', 2),
(173, 1, 1, 0, 1, 0, '14/09/2017', '00:09:49', '2017-09-14 00:09:49', 0, 167, 7, 0, '', '14', '14', 0, 1, 1, '', 2, '', 2),
(174, 1, 1, 0, 1, 0, '14/09/2017', '00:10:22', '2017-09-14 00:10:22', 0, 168, 8, 0, '', '10', '10', 0, 1, 1, '', 2, '', 2),
(175, 1, 1, 0, 1, 0, '14/09/2017', '00:10:43', '2017-09-14 00:10:43', 0, 169, 9, 0, '', '10', '10', 0, 1, 1, '', 2, '', 2),
(176, 1, 1, 0, 1, 170, '14/09/2017', '00:11:13', '2017-09-14 00:11:13', 0, 170, 10, 0, '', '0', '10', 0, 1, 1, '', 2, '', 2),
(177, 1, 1, 0, 1, 171, '14/09/2017', '00:44:58', '2017-09-14 00:44:58', 0, 171, 11, 0, '', '0', '10', 0, 1, 1, '', 2, '', 2),
(178, 1, 1, 0, 1, 0, '14/09/2017', '00:50:36', '2017-09-14 00:50:36', 20, 172, 12, 0, '', '10', '10', 0, 1, 1, '', 1, 'aaaa', 3),
(179, 1, 1, 0, 1, 185, '14/09/2017', '01:02:17', '2017-09-14 01:02:17', 18, 173, 13, 0, '', '0', '50', 0, 1, 1, '', 2, '', 2),
(180, 1, 1, 0, 1, 185, '14/09/2017', '01:02:28', '2017-09-14 01:02:28', 18, 174, 14, 0, '', '0', '4', 0, 1, 1, '', 2, '', 2),
(181, 1, 1, 0, 1, 187, '15/09/2017', '01:12:22', '2017-09-15 01:12:22', 0, 175, 1, 0, '', '0', '14', 0, 1, 1, '', 2, '', 2),
(182, 1, 1, 0, 1, 188, '15/09/2017', '01:12:35', '2017-09-15 01:12:35', 0, 176, 2, 0, '', '0', '38', 0, 1, 1, '', 2, '', 2),
(183, 1, 1, 0, 1, 0, '15/09/2017', '01:12:48', '2017-09-15 01:12:48', 5, 177, 3, 0, '', '5', '32', 0, 1, 1, '', 1, 'aaa', 3),
(184, 1, 1, 0, 1, 189, '15/09/2017', '01:29:06', '2017-09-15 01:29:06', 2, 178, 4, 0, '', '0', '61', 0, 1, 1, '', 2, '', 2),
(185, 1, 1, 0, 1, 0, '15/09/2017', '01:30:07', '2017-09-15 01:30:07', 8, 179, 5, 0, '', '5', '15', 0, 1, 1, '', 1, 'aaaaa', 3),
(186, 1, 1, 0, 1, 0, '15/09/2017', '01:50:25', '2017-09-15 01:50:25', 9, 180, 6, 0, '', '-20', '30', 0, 1, 1, '', 1, 'aaaaa', 3),
(187, 1, 1, 0, 1, 194, '15/09/2017', '01:53:00', '2017-09-15 01:53:00', 10, 181, 7, 0, '', '0', '29', 0, 2, 1, '', 2, '', 2),
(188, 1, 1, 0, 1, 0, '15/09/2017', '02:01:26', '2017-09-15 02:01:26', 15, 182, 8, 0, '', '37.5', '37.5', 0, 1, 1, '', 1, 'aaaaa', 3),
(189, 1, 1, 0, 1, 193, '15/09/2017', '02:04:01', '2017-09-15 02:04:01', 18, 183, 9, 0, '', '0', '15', 0, 1, 1, '', 2, '', 2),
(190, 1, 1, 0, 1, 197, '15/09/2017', '02:06:52', '2017-09-15 02:06:52', 11, 184, 10, 0, '', '0', '66.5', 0, 1, 1, '', 2, '', 2),
(191, 1, 1, 0, 1, 196, '15/09/2017', '03:09:40', '2017-09-15 03:09:40', 0, 185, 11, 0, '', '0', '10', 0, 1, 1, '', 2, '', 2),
(192, 1, 1, 0, 1, 198, '15/09/2017', '04:06:04', '2017-09-15 04:06:04', 0, 186, 12, 0, '', '0', '30', 0, 1, 1, '', 1, '', 2),
(193, 1, 1, 0, 1, 199, '15/09/2017', '04:06:57', '2017-09-15 04:06:57', 0, 187, 13, 0, '', '0', '30', 0, 1, 1, '', 1, '', 2),
(194, 1, 1, 0, 1, 200, '15/09/2017', '04:07:23', '2017-09-15 04:07:23', 0, 188, 14, 0, '', '0', '22', 0, 1, 1, '', 1, '', 2),
(195, 1, 1, 0, 1, 201, '15/09/2017', '04:07:47', '2017-09-15 04:07:47', 5, 189, 15, 0, '', '0', '40', 0, 1, 1, '', 1, '', 2),
(196, 1, 1, 0, 1, 0, '15/09/2017', '04:23:08', '2017-09-15 04:23:08', 5, 190, 16, 0, '', '2', '20', 0, 1, 1, '', 1, 'por error', 3),
(197, 1, 1, 0, 1, 0, '15/09/2017', '04:24:16', '2017-09-15 04:24:16', 10, 191, 17, 0, '', '10', '10', 0, 1, 1, '', 1, 'eeee', 3),
(198, 1, 1, 0, 1, 202, '15/09/2017', '04:55:59', '2017-09-15 04:55:59', 0, 192, 18, 0, '', '0', '40', 0, 1, 1, '', 1, 'por x motivos', 3),
(199, 1, 1, 0, 1, 203, '15/09/2017', '04:56:06', '2017-09-15 04:56:06', 5, 193, 19, 0, '', '0', '10', 0, 1, 1, '', 1, 'por error', 3),
(200, 1, 1, 0, 1, 0, '15/09/2017', '04:56:17', '2017-09-15 04:56:17', 9, 194, 20, 0, '', '30', '30', 0, 1, 1, '', 1, 'aaa', 3),
(201, 1, 1, 0, 1, 204, '15/09/2017', '04:57:16', '2017-09-15 04:57:16', 5, 195, 21, 0, '', '0', '2', 0, 1, 1, '', 1, 'por que es una prueba', 3),
(202, 1, 1, 0, 1, 0, '15/09/2017', '05:00:09', '2017-09-15 05:00:09', 12, 196, 22, 0, '', '30.00', '40', 0, 1, 1, '', 1, 'aaaeeeeeeee', 3),
(203, 1, 1, 0, 1, 0, '15/09/2017', '05:01:03', '2017-09-15 05:01:03', 9, 197, 23, 0, '', '10', '10', 0, 1, 1, '', 1, 'aaa', 3),
(204, 1, 1, 0, 1, 0, '15/09/2017', '05:02:01', '2017-09-15 05:02:01', 13, 198, 24, 0, '', '20', '20', 0, 1, 1, '', 1, 'aaaaa', 3),
(205, 1, 1, 0, 1, 205, '15/09/2017', '05:08:21', '2017-09-15 05:08:21', 3, 199, 25, 0, '', '0', '22', 0, 1, 1, '', 1, 'por error', 3),
(206, 1, 1, 0, 1, 0, '15/09/2017', '16:09:26', '2017-09-15 16:09:26', 1, 200, 26, 0, '', '15', '15', 0, 1, 1, '', 1, 'prueba todo el pedido', 3),
(207, 1, 1, 0, 1, 0, '15/09/2017', '20:11:58', '2017-09-15 20:11:58', 2, 201, 27, 0, '', '10', '10', 0, 1, 1, '', 1, 'prueba todos los pedidos 4 de 4', 3),
(208, 1, 1, 0, 1, 0, '15/09/2017', '20:12:14', '2017-09-15 20:12:14', 2, 202, 28, 0, '', '10.00', '20', 0, 1, 1, '', 1, 'prueba solo uno de 2 pedidos', 3),
(209, 1, 1, 0, 1, 0, '15/09/2017', '20:24:48', '2017-09-15 20:24:48', 2, 203, 29, 0, '', '6', '6', 0, 1, 1, '', 1, 'anulado desde registro publico', 3),
(210, 1, 1, 0, 1, 0, '15/09/2017', '20:25:02', '2017-09-15 20:25:02', 2, 204, 30, 0, '', '20', '20', 0, 1, 1, '', 1, 'anulado desde registro publico', 3),
(211, 1, 1, 0, 1, 0, '15/09/2017', '20:25:19', '2017-09-15 20:25:19', 2, 205, 31, 0, '', '5', '5', 0, 1, 1, '', 1, 'anulado desde registro publico', 3),
(212, 1, 1, 0, 1, 206, '15/09/2017', '20:42:42', '2017-09-15 20:42:42', 9, 206, 32, 0, '', '0', '20', 0, 1, 1, '', 1, '', 2),
(213, 1, 1, 0, 1, 0, '20/09/2017', '22:08:16', '2017-09-20 22:08:16', 9, 207, 1, 0, '', '15', '15', 0, 1, 1, '', 0, '', 0),
(214, 1, 1, 0, 1, 0, '20/09/2017', '22:11:27', '2017-09-20 22:11:27', 9, 208, 2, 0, '', '15', '25', 0, 1, 1, '', 0, '', 0),
(215, 1, 1, 0, 1, 0, '20/09/2017', '23:07:26', '2017-09-20 23:07:26', 9, 209, 3, 0, '', '42', '42', 0, 1, 1, '', 0, '', 0),
(216, 1, 1, 0, 1, 0, '21/09/2017', '00:56:58', '2017-09-21 00:56:58', 3, 210, 1, 0, '', '4', '4', 0, 1, 1, '', 0, '', 0);

-- --------------------------------------------------------

--
-- Estructura de tabla para la tabla `pedido_borrados`
--

CREATE TABLE IF NOT EXISTS `pedido_borrados` (
  `idpedido_borrados` int(10) NOT NULL AUTO_INCREMENT,
  `idpedido` int(10) NOT NULL,
  `idpedido_detalle` int(10) NOT NULL,
  `iditem` int(10) NOT NULL,
  `idusuario` int(10) NOT NULL,
  `idusuario_permiso` int(10) NOT NULL,
  `importe` varchar(8) NOT NULL,
  `fecha` varchar(30) NOT NULL,
  `hora` varchar(20) NOT NULL,
  `fecha_cierre` varchar(30) NOT NULL,
  `procede_tabla` int(1) NOT NULL COMMENT '(0=almacen_items o producto 1=carta lista 2=porcion)',
  `estado` int(1) NOT NULL DEFAULT '0',
  PRIMARY KEY (`idpedido_borrados`)
) ENGINE=InnoDB  DEFAULT CHARSET=latin1 AUTO_INCREMENT=81 ;

--
-- Volcado de datos para la tabla `pedido_borrados`
--

INSERT INTO `pedido_borrados` (`idpedido_borrados`, `idpedido`, `idpedido_detalle`, `iditem`, `idusuario`, `idusuario_permiso`, `importe`, `fecha`, `hora`, `fecha_cierre`, `procede_tabla`, `estado`) VALUES
(1, 0, 543, 0, 1, 1, '', '01/06/2017', '00:29:33', '2017-07-22 01:04:57', 0, 0),
(2, 0, 550, 0, 1, 1, '', '01/06/2017', '00:47:49', '2017-07-22 01:04:57', 0, 0),
(3, 0, 550, 0, 1, 1, '', '01/06/2017', '00:48:02', '2017-07-22 01:04:57', 0, 0),
(4, 0, 542, 0, 1, 1, '', '01/06/2017', '00:48:22', '2017-07-22 01:04:57', 0, 0),
(5, 0, 565, 0, 1, 1, '', '01/06/2017', '00:54:44', '2017-07-22 01:04:57', 0, 0),
(6, 0, 540, 0, 1, 1, '', '01/06/2017', '08:40:27', '2017-07-22 01:04:57', 0, 0),
(7, 0, 561, 0, 1, 1, '', '01/06/2017', '08:40:58', '2017-07-22 01:04:57', 0, 0),
(8, 0, 589, 0, 1, 1, '', '01/06/2017', '12:17:13', '2017-07-22 01:04:57', 0, 0),
(9, 0, 627, 0, 1, 1, '', '05/06/2017', '23:26:36', '2017-07-22 01:04:57', 0, 0),
(10, 0, 627, 0, 1, 1, '', '05/06/2017', '23:26:49', '2017-07-22 01:04:57', 0, 0),
(11, 0, 627, 0, 1, 1, '', '05/06/2017', '23:26:57', '2017-07-22 01:04:57', 0, 0),
(12, 0, 627, 0, 1, 1, '', '05/06/2017', '23:28:02', '2017-07-22 01:04:57', 0, 0),
(13, 0, 626, 0, 1, 1, '', '05/06/2017', '23:28:24', '2017-07-22 01:04:57', 0, 0),
(14, 0, 626, 0, 1, 1, '', '05/06/2017', '23:28:29', '2017-07-22 01:04:57', 0, 0),
(15, 0, 623, 0, 1, 1, '', '05/06/2017', '23:29:00', '2017-07-22 01:04:57', 0, 0),
(16, 0, 602, 0, 1, 1, '', '05/06/2017', '23:32:03', '2017-07-22 01:04:57', 0, 0),
(17, 0, 625, 0, 1, 1, '', '05/06/2017', '23:32:25', '2017-07-22 01:04:57', 0, 0),
(18, 0, 625, 0, 1, 1, '', '05/06/2017', '23:34:07', '2017-07-22 01:04:57', 0, 0),
(19, 0, 126, 0, 1, 1, '', '16/07/2017', '01:42:35', '2017-07-22 01:04:57', 0, 0),
(20, 0, 126, 0, 1, 1, '', '16/07/2017', '01:42:38', '2017-07-22 01:04:57', 0, 0),
(21, 46, 101, 0, 1, 1, '15', '16/07/2017', '02:15:27', '2017-07-22 01:04:57', 0, 0),
(22, 13, 43, 0, 1, 1, '10', '16/07/2017', '02:16:28', '2017-07-22 01:04:57', 0, 0),
(23, 11, 13, 3, 1, 1, '20', '17/07/2017', '23:04:11', '2017-07-22 01:04:57', 0, 0),
(24, 11, 13, 3, 1, 1, '10', '17/07/2017', '23:04:13', '2017-07-22 01:04:57', 0, 0),
(25, 5, 6, 116, 1, 1, '10', '17/07/2017', '23:05:59', '2017-07-22 01:04:57', 0, 0),
(26, 57, 130, 13, 1, 1, '8', '17/07/2017', '23:21:32', '2017-07-22 01:04:57', 0, 0),
(27, 4, 5, 1161, 1, 1, '10', '17/07/2017', '23:48:51', '2017-07-22 01:04:57', 0, 0),
(28, 9, 10, 1111, 1, 1, '100', '17/07/2017', '23:51:19', '2017-07-22 01:04:57', 0, 0),
(29, 36, 78, 1113, 1, 1, '30', '17/07/2017', '23:55:14', '2017-07-22 01:04:57', 0, 0),
(30, 36, 77, 1159, 1, 1, '4', '17/07/2017', '23:55:16', '2017-07-22 01:04:57', 0, 0),
(31, 9, 10, 1111, 1, 1, '20.00', '17/07/2017', '23:56:59', '2017-07-22 01:04:57', 0, 0),
(32, 57, 129, 1, 1, 1, '7.00', '18/07/2017', '00:47:44', '2017-07-22 01:04:57', 0, 0),
(33, 57, 129, 1, 1, 1, '7.00', '21/07/2017', '23:44:01', '2017-07-22 01:04:57', 0, 0),
(34, 9, 131, 1, 1, 1, '7.00', '21/07/2017', '23:44:42', '2017-07-22 01:04:57', 0, 0),
(35, 9, 131, 59, 1, 1, '7.00', '21/07/2017', '23:50:36', '2017-07-22 01:04:57', 0, 0),
(36, 9, 10, 1111, 1, 1, '20.00', '21/07/2017', '23:51:11', '2017-07-22 01:04:57', 0, 0),
(37, 196, 484, 112, 1, 1, '10.00', '15/09/2017', '04:23:17', '2017-09-15 04:55:40', 1, 0),
(38, 197, 487, 60, 1, 1, '0.00', '15/09/2017', '04:36:57', '2017-09-15 04:55:40', 1, 0),
(39, 197, 488, 63, 1, 1, '10.00', '15/09/2017', '04:36:57', '2017-09-15 04:55:40', 1, 0),
(41, 196, 485, 1159, 1, 1, '2.00', '15/09/2017', '04:56:23', '2017-09-19 08:27:59', 1, 0),
(42, 202, 498, 112, 1, 1, '10.00', '15/09/2017', '05:00:19', '2017-09-19 08:27:59', 1, 0),
(43, 204, 503, 2, 1, 1, '10.00', '15/09/2017', '05:02:13', '2017-09-19 08:27:59', 1, 0),
(44, 204, 504, 63, 1, 1, '10.00', '15/09/2017', '05:02:13', '2017-09-19 08:27:59', 1, 0),
(46, 205, 505, 59, 1, 1, '7.00', '15/09/2017', '05:08:26', '2017-09-19 08:27:59', 0, 0),
(47, 201, 497, 59, 1, 1, '0.00', '15/09/2017', '19:49:38', '2017-09-19 08:27:59', 1, 0),
(48, 201, 497, 59, 1, 1, '2.00', '15/09/2017', '19:50:59', '2017-09-19 08:27:59', 1, 0),
(49, 206, 507, 13, 1, 1, '15.00', '15/09/2017', '20:15:33', '2017-09-19 08:27:59', 1, 0),
(50, 206, 508, 59, 1, 1, '0.00', '15/09/2017', '20:15:33', '2017-09-19 08:27:59', 1, 0),
(52, 208, 513, 1163, 1, 1, '10.00', '15/09/2017', '20:17:11', '2017-09-19 08:27:59', 1, 0),
(53, 208, 511, 59, 1, 1, '0.00', '15/09/2017', '20:17:59', '2017-09-19 08:27:59', 1, 0),
(54, 208, 512, 60, 1, 1, '0.00', '15/09/2017', '20:17:59', '2017-09-19 08:27:59', 1, 0),
(55, 208, 513, 63, 1, 1, '20.00', '15/09/2017', '20:17:59', '2017-09-19 08:27:59', 1, 0),
(56, 207, 509, 60, 1, 1, '0.00', '15/09/2017', '20:26:00', '2017-09-19 08:27:59', 1, 0),
(57, 207, 510, 63, 1, 1, '10.00', '15/09/2017', '20:26:00', '2017-09-19 08:27:59', 1, 0),
(58, 209, 514, 58, 1, 1, '4.00', '15/09/2017', '20:26:00', '2017-09-19 08:27:59', 1, 0),
(59, 209, 515, 60, 1, 1, '2.00', '15/09/2017', '20:26:00', '2017-09-19 08:27:59', 1, 0),
(60, 210, 516, 2, 1, 1, '10.00', '15/09/2017', '20:26:00', '2017-09-19 08:27:59', 1, 0),
(61, 210, 517, 63, 1, 1, '10.00', '15/09/2017', '20:26:00', '2017-09-19 08:27:59', 1, 0),
(62, 211, 518, 39, 1, 1, '5.00', '15/09/2017', '20:26:00', '2017-09-19 08:27:59', 0, 0),
(63, 205, 505, 59, 1, 1, '14.00', '15/09/2017', '20:32:48', '2017-09-19 08:27:59', 0, 0),
(64, 205, 506, 63, 1, 1, '8.00', '15/09/2017', '20:32:48', '2017-09-19 08:27:59', 0, 0),
(66, 196, 485, 59, 1, 1, '0.00', '15/09/2017', '20:33:32', '2017-09-19 08:27:59', 1, 0),
(67, 196, 486, 63, 1, 1, '10.00', '15/09/2017', '20:33:32', '2017-09-19 08:27:59', 1, 0),
(68, 199, 493, 60, 1, 1, '0.00', '15/09/2017', '20:33:32', '2017-09-19 08:27:59', 1, 0),
(69, 199, 494, 63, 1, 1, '10.00', '15/09/2017', '20:33:32', '2017-09-19 08:27:59', 1, 0),
(73, 198, 489, 2, 1, 1, '10.00', '15/09/2017', '20:37:08', '2017-09-19 08:27:59', 1, 0),
(74, 198, 490, 11, 1, 1, '20.00', '15/09/2017', '20:37:08', '2017-09-19 08:27:59', 1, 0),
(75, 198, 491, 60, 1, 1, '0.00', '15/09/2017', '20:37:08', '2017-09-19 08:27:59', 1, 0),
(76, 198, 492, 63, 1, 1, '10.00', '15/09/2017', '20:37:08', '2017-09-19 08:27:59', 1, 0),
(80, 212, 519, 112, 1, 1, '10.00', '15/09/2017', '20:43:32', '2017-09-19 08:27:59', 1, 0);

-- --------------------------------------------------------

--
-- Estructura de tabla para la tabla `pedido_cambios`
--

CREATE TABLE IF NOT EXISTS `pedido_cambios` (
  `idpedido_cambios` int(10) NOT NULL AUTO_INCREMENT,
  `idpedido_detalle` int(10) NOT NULL,
  `idusuario` int(10) NOT NULL,
  `idusuario_permiso` int(10) NOT NULL,
  `fecha` varchar(30) NOT NULL,
  `hora` varchar(30) NOT NULL,
  `fecha_cierre` varchar(30) NOT NULL,
  `estado` int(1) NOT NULL DEFAULT '0',
  PRIMARY KEY (`idpedido_cambios`)
) ENGINE=InnoDB DEFAULT CHARSET=latin1 AUTO_INCREMENT=1 ;

-- --------------------------------------------------------

--
-- Estructura de tabla para la tabla `pedido_detalle`
--

CREATE TABLE IF NOT EXISTS `pedido_detalle` (
  `idpedido_detalle` int(10) NOT NULL AUTO_INCREMENT,
  `idpedido` int(10) NOT NULL,
  `idtipo_consumo` int(10) NOT NULL,
  `idcategoria` int(10) NOT NULL,
  `idcarta_lista` varchar(20) NOT NULL COMMENT 'para bodoga=idalmacen_items',
  `iditem` int(10) NOT NULL,
  `idseccion` int(10) NOT NULL,
  `cantidad` varchar(5) NOT NULL,
  `punitario` varchar(5) NOT NULL,
  `ptotal` varchar(5) NOT NULL,
  `ptotal_r` varchar(5) NOT NULL,
  `descripcion` varchar(200) NOT NULL,
  `secambio` int(2) NOT NULL DEFAULT '0',
  `borrado` int(2) NOT NULL DEFAULT '0',
  `pagado` int(1) NOT NULL DEFAULT '0' COMMENT 'pagado items',
  `procede` int(1) NOT NULL DEFAULT '0' COMMENT '0: viene de carta 1: viene de bodega',
  `procede_tabla` int(1) NOT NULL COMMENT '(0=almacen_items o producto 1=carta lista 2=porcion)',
  `estado_trigger` int(1) NOT NULL DEFAULT '0' COMMENT 'para saber que item esta pagando, trigger registro_pago_pedido',
  `idregistro_pago` int(10) NOT NULL,
  `modificado` int(1) NOT NULL DEFAULT '0' COMMENT 'para add stock, al modificar o anular pedido=1 add stock',
  `despachado` int(11) NOT NULL DEFAULT '0' COMMENT 'si ya fue despachado',
  `despachado_hora` varchar(60) NOT NULL,
  `despachado_tiempo` varchar(80) NOT NULL,
  `estado` int(1) NOT NULL DEFAULT '0',
  PRIMARY KEY (`idpedido_detalle`)
) ENGINE=InnoDB  DEFAULT CHARSET=latin1 AUTO_INCREMENT=530 ;

--
-- Volcado de datos para la tabla `pedido_detalle`
--

INSERT INTO `pedido_detalle` (`idpedido_detalle`, `idpedido`, `idtipo_consumo`, `idcategoria`, `idcarta_lista`, `iditem`, `idseccion`, `cantidad`, `punitario`, `ptotal`, `ptotal_r`, `descripcion`, `secambio`, `borrado`, `pagado`, `procede`, `procede_tabla`, `estado_trigger`, `idregistro_pago`, `modificado`, `despachado`, `despachado_hora`, `despachado_tiempo`, `estado`) VALUES
(1, 1, 1, 1, '1163', 63, 10, '2', '10.00', '20.00', '', 'ASADO DE GALLINA', 0, 0, 1, 0, 0, 0, 1, 0, 0, '', '', 0),
(2, 2, 1, 1, '112', 2, 10, '24', '10.00', '240.0', '', 'ARROZ CHAUFA REGIONAL', 0, 0, 1, 0, 0, 0, 2, 0, 0, '', '', 0),
(3, 2, 1, 1, '1163', 63, 10, '28', '10.00', '280.0', '', 'ASADO DE GALLINA', 0, 0, 1, 0, 0, 0, 2, 0, 0, '', '', 0),
(4, 3, 1, 1, '1111', 11, 10, '1', '20.00', '20.00', '', 'ASADO DE MAJAS', 0, 0, 1, 0, 0, 0, 80, 0, 0, '', '', 0),
(5, 4, 1, 1, '1161', 61, 10, '0', '10.00', '0.00', '', 'ESCABECHE DE POLLO', 0, 0, 0, 0, 0, 0, 0, 0, 0, '', '', 1),
(6, 5, 1, 1, '116', 6, 10, '0', '10.00', '0.00', '', 'TACACHO CON CECINA', 0, 0, 0, 0, 0, 0, 0, 0, 0, '', '', 1),
(7, 6, 1, 1, '1160', 60, 9, '1', '2.00', '2.00', '', 'ARROZ CON LECHE', 0, 0, 1, 0, 0, 0, 69, 0, 0, '', '', 0),
(8, 7, 1, 1, '113', 3, 1, '1', '15.00', '15.00', '', 'LOMITO SALTADO', 0, 0, 1, 0, 0, 0, 116, 0, 0, '', '', 0),
(9, 8, 1, 1, '1111', 11, 10, '5', '20.00', '100.0', '', 'ASADO DE MAJAS', 0, 0, 1, 0, 0, 0, 80, 0, 0, '', '', 0),
(10, 9, 1, 1, '1111', 11, 10, '2', '20.00', '40.00', '', 'ASADO DE MAJAS', 0, 0, 1, 0, 0, 0, 105, 0, 0, '', '', 0),
(11, 10, 1, 1, '116', 6, 10, '2', '10.00', '20.00', '', 'TACACHO CON CECINA', 0, 0, 1, 0, 0, 0, 3, 0, 0, '', '', 0),
(12, 10, 1, 1, '1159', 59, 9, '1', '2.00', '0.00', '', 'SOPA DE POLLO', 0, 0, 1, 0, 0, 0, 3, 0, 0, '', '', 0),
(13, 11, 1, 1, '117', 7, 10, '0', '10.00', '0.00', '', 'TACACHO CON CHORIZO', 0, 0, 0, 0, 0, 0, 0, 0, 0, '', '', 1),
(14, 12, 1, 1, '116', 6, 10, '1', '10.00', '10.00', '', 'TACACHO CON CECINA', 0, 0, 1, 0, 0, 0, 32, 0, 0, '', '', 0),
(15, 13, 1, 1, '1162', 62, 10, '11', '10.00', '110.0', '', 'INCHICAPI', 0, 0, 1, 0, 0, 0, 77, 0, 0, '', '', 0),
(16, 14, 1, 1, '1159', 59, 9, '2', '2.00', '2.00', '', 'SOPA DE POLLO', 0, 0, 1, 0, 0, 0, 5, 0, 0, '', '', 0),
(17, 14, 1, 1, '1162', 62, 10, '1', '10.00', '10.00', '', 'INCHICAPI', 0, 0, 1, 0, 0, 0, 6, 0, 0, '', '', 0),
(18, 15, 1, 1, '1111', 11, 10, '1', '20.00', '20.00', '', 'ASADO DE MAJAS', 0, 0, 1, 0, 0, 0, 33, 0, 0, '', '', 0),
(19, 16, 1, 1, '1111', 11, 10, '1', '20.00', '20.00', '', 'ASADO DE MAJAS', 0, 0, 1, 0, 0, 0, 9, 0, 0, '', '', 0),
(20, 16, 1, 1, '1162', 62, 10, '4', '10.00', '40.00', '', 'INCHICAPI', 0, 0, 1, 0, 0, 0, 10, 0, 0, '', '', 0),
(21, 17, 1, 1, '1159', 59, 9, '1', '2.00', '2.00', '', 'SOPA DE POLLO', 0, 0, 1, 0, 0, 0, 9, 0, 0, '', '', 0),
(22, 18, 1, 1, '113', 3, 1, '2', '15.00', '30.00', '', 'LOMITO SALTADO', 0, 0, 1, 0, 0, 0, 7, 0, 0, '', '', 0),
(23, 18, 1, 1, '1161', 61, 10, '4', '10.00', '40.00', '', 'ESCABECHE DE POLLO', 0, 0, 1, 0, 0, 1, 0, 0, 0, '', '', 0),
(24, 19, 1, 1, '1161', 61, 10, '1', '10.00', '10.00', '', 'ESCABECHE DE POLLO', 0, 0, 1, 0, 0, 0, 4, 0, 0, '', '', 0),
(25, 20, 1, 1, '113', 3, 1, '3', '15.00', '45.00', '', 'LOMITO SALTADO', 0, 0, 1, 0, 0, 0, 8, 0, 0, '', '', 0),
(26, 20, 1, 1, '1113', 13, 1, '2', '15.00', '30.00', '', 'APANADO DE TRUCHA CON PATACONES', 0, 0, 1, 0, 0, 0, 8, 0, 0, '', '', 0),
(27, 20, 1, 1, '1113', 13, 1, '2', '15.00', '30.00', '', 'APANADO DE TRUCHA CON PATACONES', 0, 0, 1, 0, 0, 0, 8, 0, 0, '', '', 0),
(28, 20, 1, 1, '1113', 13, 1, '2', '15.00', '30.00', '', 'APANADO DE TRUCHA CON PATACONES', 0, 0, 1, 0, 0, 0, 8, 0, 0, '', '', 0),
(29, 20, 1, 1, '112', 2, 10, '2', '10.00', '20.00', '', 'ARROZ CHAUFA REGIONAL', 0, 0, 1, 0, 0, 0, 8, 0, 0, '', '', 0),
(30, 20, 1, 1, '1159', 59, 9, '1', '2.00', '0.00', '', 'SOPA DE POLLO', 0, 0, 1, 0, 0, 0, 8, 0, 0, '', '', 0),
(31, 21, 1, 1, '1159', 59, 9, '5', '2.00', '10.00', '', 'SOPA DE POLLO', 0, 0, 1, 0, 0, 1, 0, 0, 0, '', '', 0),
(32, 21, 1, 1, '1160', 60, 9, '2', '2.00', '4.00', '', 'ARROZ CON LECHE', 0, 0, 1, 0, 0, 0, 10, 0, 0, '', '', 0),
